A1: Rank | B1: Player | C1: Family | D1: Networth | E1: Planets
A2: 1 | B2: Starfury | C2: Family #8 | D2: 21293629 | E2: 902
A3: =A2+1 -> 2 | B3: AznCorpulent | C3: Family #18 | D3: 13842667 | E3: 672
A4: =A3+1 -> 3 | B4: Demoner | C4: Family #28 | D4: 5755052 | E4: 609
A5: =A4+1 -> 4 | B5: Hockeytown | C5: Family #12 | D5: 19434272 | E5: 400
A6: =A5+1 -> 5 | B6: VeniVidiVice | C6: Family #12 | D6: 6502140 | E6: 302
A7: =A6+1 -> 6 | B7: Spam | C7: Family #14 | D7: 1078023 | E7: 274
A8: =A7+1 -> 7 | B8: DSK | C8: Family #15 | D8: 262214 | E8: 255
A9: =A8+1 -> 8 | B9: Gos | C9: Family #22 | D9: 4060865 | E9: 210
A10: =A9+1 -> 9 | B10: Sogils Empire | C10: Family #17 | D10: 4733408 | E10: 156
A11: =A10+1 -> 10 | B11: Marcus | C11: Family #16 | D11: 527850 | E11: 148
A12: =A11+1 -> 11 | B12: The_Galbadian_Empire | C12: Family #24 | D12: 182100 | E12: 146
A13: =A12+1 -> 12 | B13: Mobilus | C13: Family #31 | D13: 539756 | E13: 126
A14: =A13+1 -> 13 | B14: The Hobbit | C14: Family #29 | D14: 332090 | E14: 101
A15: =A14+1 -> 14 | B15: Pita | C15: Family #3 | D15: 3445336 | E15: 81
A16: =A15+1 -> 15 | B16: Merris | C16: Family #5 | D16: 68019 | E16: 22
A17: =A16+1 -> 16 | B17: POOP | C17: Family #4 | D17: 34911 | E17: 17
A18: =A17+1 -> 17 | B18: Mortis | C18: Family #28 | D18: 2866295 | E18: 16
A19: =A18+1 -> 18 | B19: Daydreamer | C19: Family #16 | D19: 22513 | E19: 16
A20: =A19+1 -> 19 | B20: DivineBreadknife | C20: Family #17 | D20: 36181 | E20: 15
A21: =A20+1 -> 20 | B21: Monkorn | C21: Family #22 | D21: 215861 | E21: 14
A22: =A21+1 -> 21 | B22: planetarium | C22: Family #9 | D22: 15903 | E22: 12
A23: =A22+1 -> 22 | B23: i am great | C23: Family #22 | D23: 554874 | E23: 11
A24: =A23+1 -> 23 | B24: GunShot | C24: Family #23 | D24: 44920 | E24: 9
A25: =A24+1 -> 24 | B25: SeTesh | C25: Family #18 | D25: 7415 | E25: 6
A26: =A25+1 -> 25 | B26: Sapke | C26: Family #26 | D26: 1104677 | E26: 6
A27: =A26+1 -> 26 | B27: Dopefish Dreaded Destroyers | C27: Family #30 | D27: 16745 | E27: 6
A28: =A27+1 -> 27 | B28: losenord | C28: Family #8 | D28: 61181 | E28: 5
A29: =A28+1 -> 28 | B29: The Flame Bringers | C29: Family #24 | D29: 5569 | E29: 4
A30: =A29+1 -> 29 | B30: zelly | C30: Family #26 | D30: 24499 | E30: 3
A31: =A30+1 -> 30 | B31: DoomLand | C31: Family #20 | D31: 4870 | E31: 3
A32: =A31+1 -> 31 | B32: The_Borg | C32: Family #15 | D32: 3319 | E32: 3
A33: =A32+1 -> 32 | B33: Rivan | C33: Family #14 | D33: 12443 | E33: 3
A34: =A33+1 -> 33 | B34: Lord Daedalos | C34: Family #8 | D34: 7236 | E34: 3
A35: =A34+1 -> 34 | B35: Black Death | C35: Family #0 | D35: 6528 | E35: 3
A36: =A35+1 -> 35 | B36: Trizm | C36: Family #10 | D36: 5239 | E36: 3
A37: =A36+1 -> 36 | B37: retorica | C37: Family #5 | D37: 3797 | E37: 3
A38: =A37+1 -> 37 | B38: Vens | C38: Family #0 | D38: 8178 | E38: 3
A39: =A38+1 -> 38 | B39: DyingFetus | C39: Family #0 | D39: 5023 | E39: 3
A40: =A39+1 -> 39 | B40: Haplo | C40: Family #24 | D40: 4025 | E40: 3
A41: =A40+1 -> 40 | B41: Tobi | C41: Family #17 | D41: 1048787 | E41: 3
A42: =A41+1 -> 41 | B42: whiteraven | C42: Family #2 | D42: 4143 | E42: 2
A43: =A42+1 -> 42 | B43: zotteke | C43: Family #1 | D43: 7292 | E43: 2
A44: =A43+1 -> 43 | B44: DragonSoul | C44: Family #17 | D44: 4082 | E44: 2
A45: =A44+1 -> 44 | B45: Royan V | C45: Family #17 | D45: 2060 | E45: 1
A46: =A45+1 -> 45 | B46: DarkKnights | C46: Family #10 | D46: 2508 | E46: 1
A47: =A46+1 -> 46 | B47: Prophet Isra | C47: Family #17 | D47: 1740 | E47: 1
A48: =A47+1 -> 47 | B48: T Rex | C48: Family #25 | D48: 1740 | E48: 1
A49: =A48+1 -> 48 | B49: Dripping Green Load | C49: Family #30 | D49: 2580 | E49: 1
A50: =A49+1 -> 49 | B50: nyteofunt | C50: Family #25 | D50: 1740 | E50: 1
A51: =A50+1 -> 50 | B51: evil Eusk | C51: Family #16 | D51: 6532 | E51: 1
A52: =A51+1 -> 51 | B52: d00d | C52: Family #5 | D52: 1740 | E52: 1
A53: =A52+1 -> 52 | B53: SuSE LINUX | C53: Family #20 | D53: 1740 | E53: 1
A54: =A53+1 -> 53 | B54: HeinousBOB | C54: Family #11 | D54: 3147 | E54: 1
A55: =A54+1 -> 54 | B55: Barrayar | C55: Family #17 | D55: 1740 | E55: 1
A56: =A55+1 -> 55 | B56: The Unknown | C56: Family #15 | D56: 2980 | E56: 1
A57: =A56+1 -> 56 | B57: miniBOB | C57: Family #19 | D57: 1740 | E57: 1
A58: =A57+1 -> 57 | B58: Rivvy | C58: Family #31 | D58: 3340 | E58: 1
A59: =A58+1 -> 58 | B59: theSCHIZOphrenICs | C59: Family #9 | D59: 1740 | E59: 1
A60: =A59+1 -> 59 | B60: Einstein | C60: Family #28 | D60: 2947 | E60: 1
A61: =A60+1 -> 60 | B61: Dookie | C61: Family #30 | D61: 2924 | E61: 1
A62: =A61+1 -> 61 | B62: Valleyman | C62: Family #12 | D62: 91321 | E62: 1
A63: =A62+1 -> 62 | B63: Canada | C63: Family #8 | D63: 2964 | E63: 1
A64: =A63+1 -> 63 | B64: Intension | C64: Family #3 | D64: 11943 | E64: 1
A65: =A64+1 -> 64 | B65: LordsOfChaos | C65: Family #31 | D65: 1740 | E65: 1
A66: =A65+1 -> 65 | B66: limburg | C66: Family #13 | D66: 5156 | E66: 1
A67: =A66+1 -> 66 | B67: Solaris | C67: Family #26 | D67: 5187 | E67: 1
A68: =A67+1 -> 67 | B68: Assclownland | C68: Family #2 | D68: 1740 | E68: 1
A69: =A68+1 -> 68 | B69: DoomLand | C69: Family #11 | D69: 1740 | E69: 1
A70: =A69+1 -> 69 | B70: DoomLand | C70: Family #24 | D70: 1740 | E70: 1
A71: =A70+1 -> 70 | B71: Paradisia | C71: Family #29 | D71: 1740 | E71: 1
A72: =A71+1 -> 71 | B72: Sinister | C72: Family #26 | D72: 1740 | E72: 1
A73: =A72+1 -> 72 | B73: The Fat Elves | C73: Family #28 | D73: 1740 | E73: 1
A74: =A73+1 -> 73 | B74: Armoured Core | C74: Family #13 | D74: 7701 | E74: 1
A75: =A74+1 -> 74 | B75: Aridia | C75: Family #1 | D75: 1740 | E75: 1
A76: =A75+1 -> 75 | B76: Dragoon Elite | C76: Family #14 | D76: 2765 | E76: 1
A77: =A76+1 -> 76 | B77: Trevelyan | C77: Family #9 | D77: 3350 | E77: 1
A78: =A77+1 -> 77 | B78: Sukaman | C78: Family #15 | D78: 3009 | E78: 1
A79: =A78+1 -> 78 | B79: Canada | C79: Family #4 | D79: 3180 | E79: 1
A80: =A79+1 -> 79 | B80: LivingShadow | C80: Family #22 | D80: 12112 | E80: 1
A81: =A80+1 -> 80 | B81: SICILIA | C81: Family #22 | D81: 8038 | E81: 1
A82: =A81+1 -> 81 | B82: viper | C82: Family #31 | D82: 82595 | E82: 1
A83: =A82+1 -> 82 | B83: barsoom | C83: Family #1 | D83: 1740 | E83: 1
A84: =A83+1 -> 83 | B84: Warhammer | C84: Family #19 | D84: 3633 | E84: 1
A85: =A84+1 -> 84 | B85: sonic | C85: Family #4 | D85: 2816 | E85: 1
A86: =A85+1 -> 85 | B86: Sonic | C86: Family #1 | D86: 1740 | E86: 1
A87: =A86+1 -> 86 | B87: Erazor | C87: Family #31 | D87: 3180 | E87: 1
A88: =A87+1 -> 87 | B88: Chunkster | C88: Family #17 | D88: 8840 | E88: 1
A89: =A88+1 -> 88 | B89: Temple of the+Sith | C89: Family #0 | D89: 1740 | E89: 1
A90: =A89+1 -> 89 | B90: Wonderin | C90: Family #12 | D90: 1740 | E90: 1
A91: =A90+1 -> 90 | B91: Outlaws7 | C91: Family #28 | D91: 1740 | E91: 1
A92: =A91+1 -> 91 | B92: MARC | C92: Family #12 | D92: 5480 | E92: 1
A93: =A92+1 -> 92 | B93: Jgriffin | C93: Family #24 | D93: 8724 | E93: 1
A94: =A93+1 -> 93 | B94: Necris | C94: Family #19 | D94: 2460 | E94: 1
A95: =A94+1 -> 94 | B95: SatansArmy | C95: Family #14 | D95: 1740 | E95: 1
A96: =A95+1 -> 95 | B96: brent | C96: Family #29 | D96: 1740 | E96: 1
A97: =A96+1 -> 96 | B97: Chili | C97: Family #25 | D97: 3706 | E97: 1
A98: =A97+1 -> 97 | B98: PooYou | C98: Family #11 | D98: 3320 | E98: 1
A99: =A98+1 -> 98 | B99: Black Paradise | C99: Family #6 | D99: 1740 | E99: 1
A100: =A99+1 -> 99 | B100: Deleted Empire | C100: Family #23 | D100: 3064 | E100: 1
A101: =A100+1 -> 100 | B101: Annihilator | C101: Family #19 | D101: 10940 | E101: 1
A102: =A101+1 -> 101 | B102: bambila-ha-ha | C102: Family #9 | D102: 1740 | E102: 1
A103: =A102+1 -> 102 | B103: Skrul | C103: Family #16 | D103: 1740 | E103: 1
A104: =A103+1 -> 103 | B104: Mr Bob | C104: Family #9 | D104: 3228 | E104: 1
A105: =A104+1 -> 104 | B105: KwiKSilva00s Hellfire | C105: Family #26 | D105: 2723 | E105: 1
A106: =A105+1 -> 105 | B106: aa | C106: Family #20 | D106: 1740 | E106: 1
A107: =A106+1 -> 106 | B107: kint | C107: Family #21 | D107: 2500 | E107: 1
A108: =A107+1 -> 107 | B108: spooky | C108: Family #20 | D108: 4260 | E108: 1
A109: =A108+1 -> 108 | B109: blah | C109: Family #8 | D109: 1740 | E109: 1
A110: =A109+1 -> 109 | B110: Robot Movement | C110: Family #18 | D110: 1740 | E110: 1
A111: =A110+1 -> 110 | B111: Illuvatar | C111: Family #17 | D111: 1740 | E111: 1
A112: =A111+1 -> 111 | B112: Aridia | C112: Family #19 | D112: 5152 | E112: 1
A113: =A112+1 -> 112 | B113: Midian | C113: Family #21 | D113: 1740 | E113: 1
A114: =A113+1 -> 113 | B114: Tailchaser | C114: Family #13 | D114: 4500 | E114: 1
A115: =A114+1 -> 114 | B115: THO | C115: Family #9 | D115: 3306 | E115: 1
A116: =A115+1 -> 115 | B116: ALTEC | C116: Family #27 | D116: 7104 | E116: 1
A117: =A116+1 -> 116 | B117: Antisun | C117: Family #15 | D117: 1740 | E117: 1
A118: =A117+1 -> 117 | B118: ktrain | C118: Family #29 | D118: 1740 | E118: 1
A119: =A118+1 -> 118 | B119: The Galbadian+Empire | C119: Family #10 | D119: 1740 | E119: 1
A120: =A119+1 -> 119 | B120: Parasites | C120: Family #4 | D120: 3980 | E120: 1
A121: =A120+1 -> 120 | B121: RealDeal | C121: Family #27 | D121: 4775 | E121: 1
A122: =A121+1 -> 121 | B122: Protoss | C122: Family #8 | D122: 3140 | E122: 1
A123: =A122+1 -> 122 | B123: FrozenY | C123: Family #30 | D123: 1740 | E123: 1
A124: =A123+1 -> 123 | B124: Paris | C124: Family #17 | D124: 1980 | E124: 1
A125: =A124+1 -> 124 | B125: Betrohemia | C125: Family #28 | D125: 1740 | E125: 1
A126: =A125+1 -> 125 | B126: FortneR | C126: Family #8 | D126: 1740 | E126: 1
A127: =A126+1 -> 126 | B127: reGGae | C127: Family #23 | D127: 3340 | E127: 1
A128: =A127+1 -> 127 | B128: BadTrip | C128: Family #13 | D128: 2852 | E128: 1
A129: =A128+1 -> 128 | B129: BadTrip | C129: Family #30 | D129: 1740 | E129: 1
A130: =A129+1 -> 129 | B130: Drew | C130: Family #18 | D130: 2380 | E130: 1
A131: =A130+1 -> 130 | B131: Revenge | C131: Family #3 | D131: 1740 | E131: 1
A132: =A131+1 -> 131 | B132: Zhao | C132: Family #29 | D132: 11056 | E132: 1
A133: =A132+1 -> 132 | B133: Marx | C133: Family #13 | D133: 1740 | E133: 1
A134: =A133+1 -> 133 | B134: mung | C134: Family #9 | D134: 3724 | E134: 1
A135: =A134+1 -> 134 | B135: Melayu | C135: Family #29 | D135: 1740 | E135: 1
A136: =A135+1 -> 135 | B136: Dazists | C136: Family #28 | D136: 17987 | E136: 1
A137: =A136+1 -> 136 | B137: Cows | C137: Family #8 | D137: 3970 | E137: 1
A138: =A137+1 -> 137 | B138: Syrinx | C138: Family #3 | D138: 1740 | E138: 1
A139: =A138+1 -> 138 | B139: NightElfClerics | C139: Family #11 | D139: 1740 | E139: 1