A1: Rank | B1: Empire | C1: Family | D1: Networth | E1: Planets
A2: 1 | B2: Greatest | C2: family #9 | D2: 17323655 | E2: 238
A3: =A2+1 -> 2 | B3: Flegel | C3: family #9 | D3: 38912995 | E3: 231
A4: =A3+1 -> 3 | B4: Xxit | C4: family #9 | D4: 31868402 | E4: 224
A5: =A4+1 -> 4 | B5: Singidunum | C5: family #9 | D5: 8015064 | E5: 178
A6: =A5+1 -> 5 | B6: Gos | C6: family #9 | D6: 7703819 | E6: 137
A7: =A6+1 -> 6 | B7: Doomsville | C7: family #32 | D7: 8424366 | E7: 133
A8: =A7+1 -> 7 | B8: Pranks | C8: family #32 | D8: 5552029 | E8: 124
A9: =A8+1 -> 8 | B9: Wilbo | C9: family #9 | D9: 3697400 | E9: 122
A10: =A9+1 -> 9 | B10: Merris | C10: family #21 | D10: 7399469 | E10: 118
A11: =A10+1 -> 10 | B11: DragoonRed | C11: family #1 | D11: 1731074 | E11: 113
A12: =A11+1 -> 11 | B12: Casualities | C12: family #32 | D12: 5719202 | E12: 112
A13: =A12+1 -> 12 | B13: FrozenY | C13: family #9 | D13: 4387724 | E13: 112
A14: =A13+1 -> 13 | B14: Starfury | C14: family #9 | D14: 5653415 | E14: 111
A15: =A14+1 -> 14 | B15: Fallout | C15: family #32 | D15: 4952201 | E15: 109
A16: =A15+1 -> 15 | B16: CityHall | C16: family #32 | D16: 3285001 | E16: 109
A17: =A16+1 -> 16 | B17: SKYeXile | C17: family #29 | D17: 4333361 | E17: 102
A18: =A17+1 -> 17 | B18: Centari | C18: family #21 | D18: 3590318 | E18: 97
A19: =A18+1 -> 18 | B19: elerian | C19: family #24 | D19: 2238650 | E19: 94
A20: =A19+1 -> 19 | B20: Sorbent_Stephen | C20: family #29 | D20: 2964166 | E20: 93
A21: =A20+1 -> 20 | B21: Must be the music | C21: family #21 | D21: 2380142 | E21: 93
A22: =A21+1 -> 21 | B22: The Lorax | C22: family #21 | D22: 6273938 | E22: 92
A23: =A22+1 -> 22 | B23: jizames | C23: family #32 | D23: 3910344 | E23: 92
A24: =A23+1 -> 23 | B24: CG | C24: family #20 | D24: 3361150 | E24: 90
A25: =A24+1 -> 24 | B25: Deztroyer | C25: family #25 | D25: 1884282 | E25: 88
A26: =A25+1 -> 25 | B26: MassKilling | C26: family #20 | D26: 3006632 | E26: 84
A27: =A26+1 -> 26 | B27: Stormblast | C27: family #9 | D27: 2729478 | E27: 79
A28: =A27+1 -> 27 | B28: Kiyan | C28: family #21 | D28: 1963120 | E28: 77
A29: =A28+1 -> 28 | B29: sathuli | C29: family #13 | D29: 2700979 | E29: 76
A30: =A29+1 -> 29 | B30: LUSTER | C30: family #25 | D30: 1675666 | E30: 76
A31: =A30+1 -> 30 | B31: Ralph | C31: family #21 | D31: 2336742 | E31: 75
A32: =A31+1 -> 31 | B32: Dragon Empire | C32: family #19 | D32: 2193811 | E32: 74
A33: =A32+1 -> 32 | B33: NAilhead | C33: family #24 | D33: 1991717 | E33: 73
A34: =A33+1 -> 33 | B34: joske | C34: family #24 | D34: 1867996 | E34: 72
A35: =A34+1 -> 34 | B35: Chacal | C35: family #34 | D35: 2567902 | E35: 70
A36: =A35+1 -> 35 | B36: Number1 | C36: family #34 | D36: 3323149 | E36: 69
A37: =A36+1 -> 36 | B37: Hulk0mania | C37: family #19 | D37: 2219164 | E37: 69
A38: =A37+1 -> 37 | B38: Behold My Soul | C38: family #2 | D38: 3606625 | E38: 68
A39: =A38+1 -> 38 | B39: dizzian | C39: family #20 | D39: 1823348 | E39: 68
A40: =A39+1 -> 39 | B40: kiwi | C40: family #8 | D40: 1166770 | E40: 68
A41: =A40+1 -> 40 | B41: PlanetInc | C41: family #29 | D41: 710509 | E41: 66
A42: =A41+1 -> 41 | B42: hip-hop empire | C42: family #10 | D42: 1809638 | E42: 64
A43: =A42+1 -> 42 | B43: Locusts | C43: family #32 | D43: 775401 | E43: 64
A44: =A43+1 -> 43 | B44: troost | C44: family #20 | D44: 745655 | E44: 64
A45: =A44+1 -> 44 | B45: prisma | C45: family #34 | D45: 2483397 | E45: 60
A46: =A45+1 -> 45 | B46: Wet The Sexy Empire | C46: family #22 | D46: 1710853 | E46: 60
A47: =A46+1 -> 46 | B47: Amnystica | C47: family #25 | D47: 1599421 | E47: 60
A48: =A47+1 -> 47 | B48: Numero 1 | C48: family #34 | D48: 2101875 | E48: 59
A49: =A48+1 -> 48 | B49: BRANDY | C49: family #32 | D49: 1134473 | E49: 59
A50: =A49+1 -> 49 | B50: Xsasinator | C50: family #8 | D50: 1081365 | E50: 57
A51: =A50+1 -> 50 | B51: Celebrition | C51: family #22 | D51: 1210283 | E51: 56
A52: =A51+1 -> 51 | B52: John_Mullins | C52: family #30 | D52: 1716628 | E52: 55
A53: =A52+1 -> 52 | B53: Skyff | C53: family #22 | D53: 842712 | E53: 55
A54: =A53+1 -> 53 | B54: sony | C54: family #20 | D54: 403961 | E54: 55
A55: =A54+1 -> 54 | B55: u will never walk alone | C55: family #24 | D55: 1156135 | E55: 54
A56: =A55+1 -> 55 | B56: psychics | C56: family #24 | D56: 833051 | E56: 54
A57: =A56+1 -> 56 | B57: Devilsempire | C57: family #25 | D57: 5780919 | E57: 53
A58: =A57+1 -> 57 | B58: Young Link | C58: family #30 | D58: 885656 | E58: 53
A59: =A58+1 -> 58 | B59: Daydreamer | C59: family #25 | D59: 3206983 | E59: 52
A60: =A59+1 -> 59 | B60: Arachnoia | C60: family #24 | D60: 672664 | E60: 52
A61: =A60+1 -> 60 | B61: Wizard CaT | C61: family #7 | D61: 1691376 | E61: 51
A62: =A61+1 -> 61 | B62: Ian | C62: family #25 | D62: 1407765 | E62: 50
A63: =A62+1 -> 62 | B63: Cheeco | C63: family #29 | D63: 1111305 | E63: 50
A64: =A63+1 -> 63 | B64: Icer | C64: family #29 | D64: 952361 | E64: 50
A65: =A64+1 -> 64 | B65: Twinsunisch Reach | C65: family #34 | D65: 449168 | E65: 50
A66: =A65+1 -> 65 | B66: serialkilla | C66: family #25 | D66: 620953 | E66: 49
A67: =A66+1 -> 66 | B67: DarkNess444 | C67: family #14 | D67: 552521 | E67: 49
A68: =A67+1 -> 67 | B68: Forest_Gump | C68: family #21 | D68: 658778 | E68: 48
A69: =A68+1 -> 68 | B69: Deadly Knight | C69: family #1 | D69: 1429583 | E69: 47
A70: =A69+1 -> 69 | B70: noobie | C70: family #32 | D70: 868567 | E70: 47
A71: =A70+1 -> 70 | B71: Blackseed | C71: family #19 | D71: 356734 | E71: 46
A72: =A71+1 -> 71 | B72: relegem | C72: family #12 | D72: 498723 | E72: 45
A73: =A72+1 -> 72 | B73: bloody | C73: family #10 | D73: 914614 | E73: 44
A74: =A73+1 -> 73 | B74: Wih | C74: family #22 | D74: 1454935 | E74: 43
A75: =A74+1 -> 74 | B75: BigCheater | C75: family #34 | D75: 284904 | E75: 41
A76: =A75+1 -> 75 | B76: Erazor | C76: family #4 | D76: 1262204 | E76: 40
A77: =A76+1 -> 76 | B77: solar | C77: family #19 | D77: 286490 | E77: 39
A78: =A77+1 -> 77 | B78: LotD | C78: family #29 | D78: 1742985 | E78: 38
A79: =A78+1 -> 78 | B79: Falcatron | C79: family #20 | D79: 966518 | E79: 38
A80: =A79+1 -> 79 | B80: IEATSPAM | C80: family #1 | D80: 478999 | E80: 38
A81: =A80+1 -> 80 | B81: Hulk | C81: family #33 | D81: 420892 | E81: 38
A82: =A81+1 -> 81 | B82: mOrrI_sEm_sAbEr | C82: family #8 | D82: 685232 | E82: 36
A83: =A82+1 -> 82 | B83: Peppi the Checker | C83: family #30 | D83: 194106 | E83: 36
A84: =A83+1 -> 83 | B84: SCoRPioN eMPiRe | C84: family #14 | D84: 776561 | E84: 35
A85: =A84+1 -> 84 | B85: LorDKiet | C85: family #14 | D85: 711221 | E85: 35
A86: =A85+1 -> 85 | B86: INVADERS | C86: family #25 | D86: 603486 | E86: 35
A87: =A86+1 -> 86 | B87: Gons | C87: family #14 | D87: 520280 | E87: 34
A88: =A87+1 -> 87 | B88: DK_Napalm | C88: family #22 | D88: 1136653 | E88: 33
A89: =A88+1 -> 88 | B89: valiare | C89: family #30 | D89: 347895 | E89: 33
A90: =A89+1 -> 89 | B90: ToRnAdO | C90: family #35 | D90: 2348812 | E90: 32
A91: =A90+1 -> 90 | B91: luv of mystique | C91: family #24 | D91: 292198 | E91: 32
A92: =A91+1 -> 91 | B92: intension | C92: family #24 | D92: 601196 | E92: 30
A93: =A92+1 -> 92 | B93: Sandrolaria | C93: family #32 | D93: 1470709 | E93: 29
A94: =A93+1 -> 93 | B94: zooger | C94: family #29 | D94: 579193 | E94: 28
A95: =A94+1 -> 94 | B95: Crusaders | C95: family #4 | D95: 396335 | E95: 28
A96: =A95+1 -> 95 | B96: Seriph | C96: family #30 | D96: 1324096 | E96: 27
A97: =A96+1 -> 96 | B97: Grasshopper | C97: family #34 | D97: 438142 | E97: 27
A98: =A97+1 -> 97 | B98: AmericA | C98: family #8 | D98: 971238 | E98: 26
A99: =A98+1 -> 98 | B99: monkeys | C99: family #30 | D99: 203084 | E99: 26
A100: =A99+1 -> 99 | B100: Attila | C100: family #17 | D100: 573914 | E100: 25
A101: =A100+1 -> 100 | B101: mm | C101: family #19 | D101: 507078 | E101: 25
A102: =A101+1 -> 101 | B102: boogje | C102: family #2 | D102: 302904 | E102: 24
A103: =A102+1 -> 102 | B103: hell | C103: family #22 | D103: 300421 | E103: 23
A104: =A103+1 -> 103 | B104: Sleeping Ducks | C104: family #0 | D104: 210629 | E104: 23
A105: =A104+1 -> 104 | B105: SilverBlue | C105: family #27 | D105: 85161 | E105: 23
A106: =A105+1 -> 105 | B106: silentbobs | C106: family #18 | D106: 913132 | E106: 21
A107: =A106+1 -> 106 | B107: Alfa Centauri | C107: family #3 | D107: 371897 | E107: 21
A108: =A107+1 -> 107 | B108: Muse | C108: family #17 | D108: 179838 | E108: 21
A109: =A108+1 -> 108 | B109: ESM | C109: family #14 | D109: 89279 | E109: 21
A110: =A109+1 -> 109 | B110: Multiple | C110: family #1 | D110: 818284 | E110: 19
A111: =A110+1 -> 110 | B111: two idiots with a stick | C111: family #30 | D111: 106617 | E111: 19
A112: =A111+1 -> 111 | B112: Talic | C112: family #33 | D112: 200517 | E112: 18
A113: =A112+1 -> 112 | B113: Hawaiianz | C113: family #35 | D113: 180510 | E113: 17
A114: =A113+1 -> 113 | B114: TB | C114: family #35 | D114: 128589 | E114: 17
A115: =A114+1 -> 114 | B115: Rattrap64 | C115: family #4 | D115: 72646 | E115: 17
A116: =A115+1 -> 115 | B116: paper empire | C116: family #10 | D116: 29670 | E116: 17
A117: =A116+1 -> 116 | B117: RealDeal_OwnZ_uOO | C117: family #35 | D117: 192542 | E117: 16
A118: =A117+1 -> 117 | B118: Vivanti | C118: family #13 | D118: 153861 | E118: 16
A119: =A118+1 -> 118 | B119: GVD | C119: family #22 | D119: 59464 | E119: 16
A120: =A119+1 -> 119 | B120: Mahama | C120: family #16 | D120: 114678 | E120: 15
A121: =A120+1 -> 120 | B121: TD | C121: family #0 | D121: 44786 | E121: 15
A122: =A121+1 -> 121 | B122: salkin | C122: family #19 | D122: 28126 | E122: 14
A123: =A122+1 -> 122 | B123: Multi | C123: family #25 | D123: 19689 | E123: 14
A124: =A123+1 -> 123 | B124: Jaguar | C124: family #19 | D124: 245099 | E124: 13
A125: =A124+1 -> 124 | B125: Deepwood | C125: family #24 | D125: 164632 | E125: 13
A126: =A125+1 -> 125 | B126: OlYmPiAn MaKeR | C126: family #28 | D126: 98187 | E126: 13
A127: =A126+1 -> 126 | B127: Jooish | C127: family #22 | D127: 71435 | E127: 13
A128: =A127+1 -> 127 | B128: RiotingVirus | C128: family #21 | D128: 54260 | E128: 13
A129: =A128+1 -> 128 | B129: Wonderland | C129: family #19 | D129: 51505 | E129: 13
A130: =A129+1 -> 129 | B130: Nisnaboria | C130: family #21 | D130: 50180 | E130: 13
A131: =A130+1 -> 130 | B131: DragonsRage | C131: family #18 | D131: 474929 | E131: 12
A132: =A131+1 -> 131 | B132: State | C132: family #15 | D132: 102536 | E132: 12
A133: =A132+1 -> 132 | B133: Seed | C133: family #8 | D133: 95775 | E133: 11
A134: =A133+1 -> 133 | B134: TheBigOne | C134: family #8 | D134: 30706 | E134: 11
A135: =A134+1 -> 134 | B135: Pandemonium | C135: family #19 | D135: 17436 | E135: 11
A136: =A135+1 -> 135 | B136: killermunkies | C136: family #20 | D136: 163852 | E136: 10
A137: =A136+1 -> 136 | B137: Empire of Alcohol | C137: family #30 | D137: 99180 | E137: 10
A138: =A137+1 -> 137 | B138: Veghel | C138: family #27 | D138: 48200 | E138: 10
A139: =A138+1 -> 138 | B139: ShadowHawk | C139: family #33 | D139: 24268 | E139: 10
A140: =A139+1 -> 139 | B140: Pershing2 | C140: family #16 | D140: 25194 | E140: 8
A141: =A140+1 -> 140 | B141: Subterranean Homesick Alien | C141: family #29 | D141: 20284 | E141: 8
A142: =A141+1 -> 141 | B142: Sadbaton | C142: family #1 | D142: 70724 | E142: 7
A143: =A142+1 -> 142 | B143: Half Wit | C143: family #18 | D143: 42545 | E143: 7
A144: =A143+1 -> 143 | B144: T-BOMB | C144: family #3 | D144: 42416 | E144: 7
A145: =A144+1 -> 144 | B145: BaggeliuS | C145: family #20 | D145: 30404 | E145: 7
A146: =A145+1 -> 145 | B146: Edison | C146: family #29 | D146: 20407 | E146: 7
A147: =A146+1 -> 146 | B147: Friendship Empire | C147: family #17 | D147: 15962 | E147: 7
A148: =A147+1 -> 147 | B148: Jesaja | C148: family #23 | D148: 15323 | E148: 7
A149: =A148+1 -> 148 | B149: EastGermanWallDogs | C149: family #19 | D149: 98318 | E149: 5
A150: =A149+1 -> 149 | B150: Zidigar | C150: family #23 | D150: 39529 | E150: 5
A151: =A150+1 -> 150 | B151: philemon | C151: family #28 | D151: 37615 | E151: 5
A152: =A151+1 -> 151 | B152: Acheron | C152: family #35 | D152: 30289 | E152: 5
A153: =A152+1 -> 152 | B153: Alphaking | C153: family #12 | D153: 20603 | E153: 5
A154: =A153+1 -> 153 | B154: Majin Gohan | C154: family #26 | D154: 12927 | E154: 5
A155: =A154+1 -> 154 | B155: Pombal | C155: family #11 | D155: 7391 | E155: 5
A156: =A155+1 -> 155 | B156: Demoner | C156: family #1 | D156: 52588 | E156: 4
A157: =A156+1 -> 156 | B157: monkorn | C157: family #12 | D157: 11728 | E157: 4
A158: =A157+1 -> 157 | B158: Roxeanne | C158: family #28 | D158: 10904 | E158: 4
A159: =A158+1 -> 158 | B159: Mace | C159: family #22 | D159: 8975 | E159: 4
A160: =A159+1 -> 159 | B160: Yugo | C160: family #15 | D160: 38619 | E160: 3
A161: =A160+1 -> 160 | B161: IceLandCubes | C161: family #2 | D161: 20135 | E161: 3
A162: =A161+1 -> 161 | B162: ghosts | C162: family #35 | D162: 15718 | E162: 3
A163: =A162+1 -> 162 | B163: Dark Firestorm | C163: family #13 | D163: 12680 | E163: 3
A164: =A163+1 -> 163 | B164: Himura Battousai | C164: family #35 | D164: 12043 | E164: 3
A165: =A164+1 -> 164 | B165: trap | C165: family #10 | D165: 8892 | E165: 3
A166: =A165+1 -> 165 | B166: TheSorcerer | C166: family #4 | D166: 8794 | E166: 3
A167: =A166+1 -> 166 | B167: captain_bob | C167: family #0 | D167: 6300 | E167: 3
A168: =A167+1 -> 167 | B168: Link | C168: family #4 | D168: 5179 | E168: 3
A169: =A168+1 -> 168 | B169: Trail of DEAD | C169: family #26 | D169: 5161 | E169: 3
A170: =A169+1 -> 169 | B170: KingOfBongo | C170: family #8 | D170: 5015 | E170: 3
A171: =A170+1 -> 170 | B171: Firestorms | C171: family #33 | D171: 4891 | E171: 3
A172: =A171+1 -> 171 | B172: NoRpLaNdS | C172: family #27 | D172: 4331 | E172: 3
A173: =A172+1 -> 172 | B173: Appeltje | C173: family #18 | D173: 4280 | E173: 3
A174: =A173+1 -> 173 | B174: DRAGONS | C174: family #34 | D174: 4155 | E174: 3
A175: =A174+1 -> 174 | B175: AdriusAvangion | C175: family #8 | D175: 3473 | E175: 3
A176: =A175+1 -> 175 | B176: slifty | C176: family #0 | D176: 3322 | E176: 3
A177: =A176+1 -> 176 | B177: jangoian | C177: family #6 | D177: 42745 | E177: 2
A178: =A177+1 -> 177 | B178: Larimos | C178: family #16 | D178: 16256 | E178: 2
A179: =A178+1 -> 178 | B179: dockers | C179: family #17 | D179: 12368 | E179: 2
A180: =A179+1 -> 179 | B180: Dripping Green Load | C180: family #12 | D180: 5861 | E180: 2
A181: =A180+1 -> 180 | B181: Haribo11 | C181: family #2 | D181: 4294 | E181: 2
A182: =A181+1 -> 181 | B182: outworld | C182: family #18 | D182: 4219 | E182: 2
A183: =A182+1 -> 182 | B183: Dominator | C183: family #28 | D183: 4163 | E183: 2
A184: =A183+1 -> 183 | B184: Moon | C184: family #11 | D184: 3563 | E184: 2
A185: =A184+1 -> 184 | B185: gong | C185: family #15 | D185: 2534 | E185: 2
A186: =A185+1 -> 185 | B186: Human Slaughter | C186: family #24 | D186: 30199 | E186: 1
A187: =A186+1 -> 186 | B187: jang0 | C187: family #34 | D187: 17934 | E187: 1
A188: =A187+1 -> 187 | B188: Trendkill | C188: family #1 | D188: 13924 | E188: 1
A189: =A188+1 -> 188 | B189: CHOMP ON THIS BEYATCH | C189: family #7 | D189: 10720 | E189: 1
A190: =A189+1 -> 189 | B190: WhiteSands | C190: family #31 | D190: 9320 | E190: 1
A191: =A190+1 -> 190 | B191: Castro | C191: family #35 | D191: 9062 | E191: 1
A192: =A191+1 -> 191 | B192: the Small Red Hill | C192: family #14 | D192: 8924 | E192: 1
A193: =A192+1 -> 192 | B193: Null | C193: family #31 | D193: 8489 | E193: 1
A194: =A193+1 -> 193 | B194: Acanthos3 | C194: family #21 | D194: 8424 | E194: 1
A195: =A194+1 -> 194 | B195: Death Prince | C195: family #30 | D195: 7981 | E195: 1
A196: =A195+1 -> 195 | B196: UNDEAD | C196: family #17 | D196: 7556 | E196: 1
A197: =A196+1 -> 196 | B197: LEGION | C197: family #7 | D197: 6130 | E197: 1
A198: =A197+1 -> 197 | B198: Gekko | C198: family #11 | D198: 6080 | E198: 1
A199: =A198+1 -> 198 | B199: putos | C199: family #16 | D199: 5651 | E199: 1
A200: =A199+1 -> 199 | B200: BL00DY | C200: family #7 | D200: 5268 | E200: 1
A201: =A200+1 -> 200 | B201: GodAmong | C201: family #13 | D201: 5180 | E201: 1
A202: =A201+1 -> 201 | B202: The Imperium | C202: family #14 | D202: 5158 | E202: 1
A203: =A202+1 -> 202 | B203: Pershing | C203: family #3 | D203: 5145 | E203: 1
A204: =A203+1 -> 203 | B204: Offspring | C204: family #17 | D204: 5020 | E204: 1
A205: =A204+1 -> 204 | B205: DroidsDK | C205: family #0 | D205: 4894 | E205: 1
A206: =A205+1 -> 205 | B206: Oasis | C206: family #27 | D206: 4526 | E206: 1
A207: =A206+1 -> 206 | B207: Centauri | C207: family #10 | D207: 4371 | E207: 1
A208: =A207+1 -> 207 | B208: jango | C208: family #12 | D208: 4034 | E208: 1
A209: =A208+1 -> 208 | B209: Sunga | C209: family #35 | D209: 3980 | E209: 1
A210: =A209+1 -> 209 | B210: Xander Zone | C210: family #4 | D210: 3913 | E210: 1
A211: =A210+1 -> 210 | B211: Xavier | C211: family #16 | D211: 3880 | E211: 1
A212: =A211+1 -> 211 | B212: TaZZmAiNiAnZZ | C212: family #14 | D212: 3685 | E212: 1
A213: =A212+1 -> 212 | B213: Life Incarnate | C213: family #13 | D213: 3665 | E213: 1
A214: =A213+1 -> 213 | B214: NYTEofUNT | C214: family #17 | D214: 3660 | E214: 1
A215: =A214+1 -> 214 | B215: GreyLensman | C215: family #31 | D215: 3401 | E215: 1
A216: =A215+1 -> 215 | B216: ANTI-JAGUAR | C216: family #14 | D216: 3380 | E216: 1
A217: =A216+1 -> 216 | B217: Porcus | C217: family #1 | D217: 3340 | E217: 1
A218: =A217+1 -> 217 | B218: Empire of Draxness | C218: family #7 | D218: 3100 | E218: 1
A219: =A218+1 -> 218 | B219: Opti | C219: family #23 | D219: 3040 | E219: 1
A220: =A219+1 -> 219 | B220: Darchon | C220: family #23 | D220: 2993 | E220: 1
A221: =A220+1 -> 220 | B221: Captain Buliwyf | C221: family #28 | D221: 2940 | E221: 1
A222: =A221+1 -> 221 | B222: Mushyfung | C222: family #18 | D222: 2940 | E222: 1
A223: =A222+1 -> 222 | B223: lostprophet | C223: family #2 | D223: 2920 | E223: 1
A224: =A223+1 -> 223 | B224: strange_man | C224: family #27 | D224: 2860 | E224: 1
A225: =A224+1 -> 224 | B225: Mime-a-mation | C225: family #4 | D225: 2580 | E225: 1
A226: =A225+1 -> 225 | B226: Star Risk Ltd | C226: family #10 | D226: 2500 | E226: 1
A227: =A226+1 -> 226 | B227: ElGatoVolador | C227: family #26 | D227: 2412 | E227: 1
A228: =A227+1 -> 227 | B228: UNDERGROUND | C228: family #20 | D228: 2380 | E228: 1
A229: =A228+1 -> 228 | B229: Empire of Chimps | C229: family #18 | D229: 2229 | E229: 1
A230: =A229+1 -> 229 | B230: SneakySnake | C230: family #6 | D230: 2140 | E230: 1
A231: =A230+1 -> 230 | B231: ICE | C231: family #6 | D231: 2060 | E231: 1
A232: =A231+1 -> 231 | B232: The holy Smurfs Empire | C232: family #16 | D232: 2030 | E232: 1
A233: =A232+1 -> 232 | B233: Lazzzzzy | C233: family #4 | D233: 1836 | E233: 1
A234: =A233+1 -> 233 | B234: darktemplar | C234: family #12 | D234: 1820 | E234: 1
A235: =A234+1 -> 234 | B235: aplusses | C235: family #27 | D235: 1800 | E235: 1
A236: =A235+1 -> 235 | B236: IMPERIUM | C236: family #28 | D236: 1748 | E236: 1
A237: =A236+1 -> 236 | B237: DutchDemons | C237: family #9 | D237: 1740 | E237: 1
A238: =A237+1 -> 237 | B238: FortneR | C238: family #14 | D238: 1740 | E238: 1
A239: =A238+1 -> 238 | B239: The ever victorious army | C239: family #0 | D239: 1740 | E239: 1
A240: =A239+1 -> 239 | B240: Chaos | C240: family #33 | D240: 1740 | E240: 1
A241: =A240+1 -> 240 | B241: GhostInShells | C241: family #27 | D241: 1740 | E241: 1
A242: =A241+1 -> 241 | B242: duelmasters | C242: family #26 | D242: 1740 | E242: 1
A243: =A242+1 -> 242 | B243: Silence of the Mimes | C243: family #2 | D243: 1740 | E243: 1
A244: =A243+1 -> 243 | B244: promos | C244: family #7 | D244: 1740 | E244: 1
A245: =A244+1 -> 244 | B245: Draytax | C245: family #11 | D245: 1740 | E245: 1
A246: =A245+1 -> 245 | B246: Flamesofhell | C246: family #1 | D246: 1740 | E246: 1
A247: =A246+1 -> 246 | B247: Ragag | C247: family #15 | D247: 1740 | E247: 1
A248: =A247+1 -> 247 | B248: criminal_damage | C248: family #11 | D248: 1740 | E248: 1
A249: =A248+1 -> 248 | B249: Beautiful suicide | C249: family #10 | D249: 1740 | E249: 1
A250: =A249+1 -> 249 | B250: test | C250: family #12 | D250: 1740 | E250: 1
A251: =A250+1 -> 250 | B251: BEYATCH | C251: family #16 | D251: 1740 | E251: 1
A252: =A251+1 -> 251 | B252: Sogil | C252: family #6 | D252: 1740 | E252: 1
A253: =A252+1 -> 252 | B253: Sue | C253: family #5 | D253: 1740 | E253: 1
A254: =A253+1 -> 253 | B254: Eraser | C254: family #26 | D254: 1740 | E254: 1
A255: =A254+1 -> 254 | B255: donerkebaps | C255: family #13 | D255: 1740 | E255: 1
A256: =A255+1 -> 255 | B256: Arganon | C256: family #23 | D256: 1740 | E256: 1
A257: =A256+1 -> 256 | B257: Sardukar | C257: family #5 | D257: 1740 | E257: 1
A258: =A257+1 -> 257 | B258: Cut Throat Jake | C258: family #3 | D258: 1740 | E258: 1
A259: =A258+1 -> 258 | B259: Mnelf | C259: family #29 | D259: 1740 | E259: 1
A260: =A259+1 -> 259 | B260: Adeath_Stein | C260: family #0 | D260: 1740 | E260: 1
A261: =A260+1 -> 260 | B261: Sunschine | C261: family #31 | D261: 1740 | E261: 1
A262: =A261+1 -> 261 | B262: Twinsunisch reach | C262: family #31 | D262: 1740 | E262: 1
A263: =A262+1 -> 262 | B263: DarkReaver | C263: family #16 | D263: 1740 | E263: 1
A264: =A263+1 -> 263 | B264: zombie | C264: family #34 | D264: 1740 | E264: 1
A265: =A264+1 -> 264 | B265: nooob | C265: family #26 | D265: 1740 | E265: 1
A266: =A265+1 -> 265 | B266: Distruction | C266: family #5 | D266: 1740 | E266: 1
A267: =A266+1 -> 266 | B267: Morpheus | C267: family #1 | D267: 1740 | E267: 1
A268: =A267+1 -> 267 | B268: carps | C268: family #22 | D268: 1740 | E268: 1
A269: =A268+1 -> 268 | B269: Slayer880 | C269: family #10 | D269: 1740 | E269: 1
A270: =A269+1 -> 269 | B270: ordos234 | C270: family #5 | D270: 1740 | E270: 1
A271: =A270+1 -> 270 | B271: marco | C271: family #11 | D271: 1740 | E271: 1
A272: =A271+1 -> 271 | B272: Ace | C272: family #18 | D272: 1740 | E272: 1
A273: =A272+1 -> 272 | B273: Roban | C273: family #31 | D273: 1740 | E273: 1
A274: =A273+1 -> 273 | B274: BustaNut | C274: family #8 | D274: 1740 | E274: 1
A275: =A274+1 -> 274 | B275: motecuzhoma | C275: family #8 | D275: 1740 | E275: 1
A276: =A275+1 -> 275 | B276: Iliad | C276: family #20 | D276: 1740 | E276: 1
A277: =A276+1 -> 276 | B277: Lunar Corporation | C277: family #12 | D277: 1740 | E277: 1
A278: =A277+1 -> 277 | B278: Gothmog | C278: family #33 | D278: 1740 | E278: 1
A279: =A278+1 -> 278 | B279: Fatality | C279: family #5 | D279: 1740 | E279: 1
A280: =A279+1 -> 279 | B280: Souljahz | C280: family #16 | D280: 1480 | E280: 1