A1: Rank | B1: Name | C1: Planets | D1: Networth
A2: 1 | B2: Here we go again!! #9 | C2: 739 | D2: 22263474
A3: =A2+1 -> 2 | B3: We Worship Smileys #22 | C3: 426 | D3: 6600079
A4: =A3+1 -> 3 | B4: Dr Suess #21 | C4: 391 | D4: 6463918
A5: =A4+1 -> 4 | B5: (Ї`·._.·[ This Fam Rules !!! ]·._.·ґЇ) #18 | C5: 460 | D5: 6412098
A6: =A5+1 -> 5 | B6: Galactic Warriors #3 | C6: 234 | D6: 4888566
A7: =A6+1 -> 6 | B7: Sunny Soldiers :) #19 | C7: 229 | D7: 3678577
A8: =A7+1 -> 7 | B8: He who screams and runs away will live to fight another day! : #10 | C8: 270 | D8: 3527819
A9: =A8+1 -> 8 | B9: Daydreamers' minions #23 | C9: 206 | D9: 2800936
A10: =A9+1 -> 9 | B10: Killers of ... HMmmmmmmmmmm #13 | C10: 210 | D10: 2202080
A11: =A10+1 -> 10 | B11: Neopolitan #14 | C11: 188 | D11: 2036431
A12: =A11+1 -> 11 | B12: w00t!!!!!!!!! #8 | C12: 175 | D12: 1884907
A13: =A12+1 -> 12 | B13: Yugoslutvia home of the winners! #2 | C13: 224 | D13: 1857454
A14: =A13+1 -> 13 | B14: f00ls :D #6 | C14: 193 | D14: 1606366
A15: =A14+1 -> 14 | B15: ~Fame And Fortune~ #5 | C15: 123 | D15: 1180639
A16: =A15+1 -> 15 | B16: Ulti's Evil Pants #0 | C16: 162 | D16: 1051233
A17: =A16+1 -> 16 | B17: Revenge #15 | C17: 164 | D17: 1029147
A18: =A17+1 -> 17 | B18: Doppler Effect #16 | C18: 135 | D18: 980549
A19: =A18+1 -> 18 | B19: Sons of Zuro #12 | C19: 119 | D19: 704597
A20: =A19+1 -> 19 | B20: Meduradian Killers #4 | C20: 88 | D20: 701729
A21: =A20+1 -> 20 | B21: weeeeeeeeeeee!!! #7 | C21: 125 | D21: 680386
A22: =A21+1 -> 21 | B22: Warrior Corruption #20 | C22: 109 | D22: 610685
A23: =A22+1 -> 22 | B23: AoD »» Age of Death #11 | C23: 103 | D23: 479451
A24: =A23+1 -> 23 | B24: Death to everyone that is rule number #1 | C24: 72 | D24: 367075
A25: =A24+1 -> 24 | B25: EctroVerse foreva!!! #17 | C25: 42 | D25: 224510