A1: Rank | B1: Player | C1: Family | D1: Networth | E1: Planets
A2: 1 | B2: Deztroyer | C2: Family #29 | D2: 45141181 | E2: 254
A3: =A2+1 -> 2 | B3: spooky | C3: Family #7 | D3: 34110425 | E3: 229
A4: =A3+1 -> 3 | B4: Dazists | C4: Family #1 | D4: 27627167 | E4: 199
A5: =A4+1 -> 4 | B5: ICE | C5: Family #29 | D5: 15046865 | E5: 175
A6: =A5+1 -> 5 | B6: flegel | C6: Family #27 | D6: 39318566 | E6: 159
A7: =A6+1 -> 6 | B7: Crystal Forest | C7: Family #29 | D7: 6336723 | E7: 148
A8: =A7+1 -> 7 | B8: DarkMan | C8: Family #29 | D8: 11128388 | E8: 134
A9: =A8+1 -> 8 | B9: DarkWorld | C9: Family #29 | D9: 12399616 | E9: 134
A10: =A9+1 -> 9 | B10: Archlich | C10: Family #10 | D10: 11584685 | E10: 133
A11: =A10+1 -> 10 | B11: Starfury | C11: Family #11 | D11: 7438385 | E11: 132
A12: =A11+1 -> 11 | B12: Devilsempire | C12: Family #15 | D12: 8391682 | E12: 117
A13: =A12+1 -> 12 | B13: Crucifix | C13: Family #8 | D13: 2186456 | E13: 112
A14: =A13+1 -> 13 | B14: SCoRPioN EmPiRe | C14: Family #15 | D14: 5831254 | E14: 110
A15: =A14+1 -> 14 | B15: jets | C15: Family #10 | D15: 3566103 | E15: 94
A16: =A15+1 -> 15 | B16: Zeta Reticuli | C16: Family #10 | D16: 5670113 | E16: 87
A17: =A16+1 -> 16 | B17: simania | C17: Family #29 | D17: 6533894 | E17: 86
A18: =A17+1 -> 17 | B18: Roxeanne | C18: Family #18 | D18: 1291738 | E18: 82
A19: =A18+1 -> 18 | B19: Stealth Assassin | C19: Family #30 | D19: 3157090 | E19: 75
A20: =A19+1 -> 19 | B20: Solaris | C20: Family #23 | D20: 2709363 | E20: 73
A21: =A20+1 -> 20 | B21: Appeltje | C21: Family #8 | D21: 3818478 | E21: 71
A22: =A21+1 -> 21 | B22: Titans | C22: Family #29 | D22: 12323493 | E22: 71
A23: =A22+1 -> 22 | B23: Doomsville | C23: Family #11 | D23: 5038466 | E23: 69
A24: =A23+1 -> 23 | B24: Betrohemia | C24: Family #29 | D24: 3521840 | E24: 67
A25: =A24+1 -> 24 | B25: Xpire | C25: Family #8 | D25: 3215354 | E25: 66
A26: =A25+1 -> 25 | B26: Daydreamer | C26: Family #11 | D26: 5293400 | E26: 65
A27: =A26+1 -> 26 | B27: darkforces | C27: Family #8 | D27: 2410528 | E27: 64
A28: =A27+1 -> 27 | B28: Serial Killa | C28: Family #8 | D28: 2048317 | E28: 60
A29: =A28+1 -> 28 | B29: da ya nayu | C29: Family #10 | D29: 3251468 | E29: 59
A30: =A29+1 -> 29 | B30: Wolfen | C30: Family #1 | D30: 3365354 | E30: 56
A31: =A30+1 -> 30 | B31: RiotingVirus | C31: Family #10 | D31: 2314708 | E31: 56
A32: =A31+1 -> 31 | B32: WTF | C32: Family #26 | D32: 388899 | E32: 55
A33: =A32+1 -> 32 | B33: Centauri | C33: Family #29 | D33: 1010509 | E33: 53
A34: =A33+1 -> 33 | B34: brand | C34: Family #18 | D34: 402796 | E34: 52
A35: =A34+1 -> 34 | B35: Muh | C35: Family #7 | D35: 987680 | E35: 51
A36: =A35+1 -> 35 | B36: SINNERS | C36: Family #18 | D36: 362110 | E36: 50
A37: =A36+1 -> 36 | B37: Wizard CaT | C37: Family #5 | D37: 3431404 | E37: 50
A38: =A37+1 -> 37 | B38: Behold My Soul | C38: Family #26 | D38: 2209695 | E38: 50
A39: =A38+1 -> 38 | B39: elerian | C39: Family #29 | D39: 2995574 | E39: 49
A40: =A39+1 -> 39 | B40: Gos | C40: Family #11 | D40: 956240 | E40: 48
A41: =A40+1 -> 40 | B41: UNDERGROUND | C41: Family #10 | D41: 580530 | E41: 48
A42: =A41+1 -> 41 | B42: Hockeytown | C42: Family #25 | D42: 1975815 | E42: 47
A43: =A42+1 -> 42 | B43: Kiyan | C43: Family #21 | D43: 2963149 | E43: 47
A44: =A43+1 -> 43 | B44: Young Link | C44: Family #1 | D44: 2579941 | E44: 46
A45: =A44+1 -> 44 | B45: AutumnWindz | C45: Family #26 | D45: 943274 | E45: 42
A46: =A45+1 -> 45 | B46: BadTrip | C46: Family #23 | D46: 1011388 | E46: 41
A47: =A46+1 -> 46 | B47: TwilighT | C47: Family #8 | D47: 2150373 | E47: 39
A48: =A47+1 -> 47 | B48: Attila | C48: Family #30 | D48: 2608122 | E48: 38
A49: =A48+1 -> 48 | B49: Killer Bug | C49: Family #29 | D49: 1453339 | E49: 38
A50: =A49+1 -> 49 | B50: Ph | C50: Family #17 | D50: 275211 | E50: 37
A51: =A50+1 -> 50 | B51: Dookie | C51: Family #29 | D51: 345030 | E51: 37
A52: =A51+1 -> 51 | B52: solle | C52: Family #8 | D52: 1209623 | E52: 36
A53: =A52+1 -> 52 | B53: mm | C53: Family #23 | D53: 629994 | E53: 32
A54: =A53+1 -> 53 | B54: Streepkesco | C54: Family #21 | D54: 241434 | E54: 31
A55: =A54+1 -> 54 | B55: Bluebeard | C55: Family #8 | D55: 247226 | E55: 31
A56: =A55+1 -> 55 | B56: John_Mullins | C56: Family #1 | D56: 190501 | E56: 30
A57: =A56+1 -> 56 | B57: smallkwyzanny | C57: Family #11 | D57: 880895 | E57: 30
A58: =A57+1 -> 57 | B58: Limburg | C58: Family #18 | D58: 355098 | E58: 29
A59: =A58+1 -> 58 | B59: Painkiller | C59: Family #30 | D59: 1111274 | E59: 28
A60: =A59+1 -> 59 | B60: MacinTrash | C60: Family #8 | D60: 429100 | E60: 27
A61: =A60+1 -> 60 | B61: Speje | C61: Family #30 | D61: 200804 | E61: 25
A62: =A61+1 -> 61 | B62: Alfa Centauri | C62: Family #18 | D62: 945751 | E62: 25
A63: =A62+1 -> 62 | B63: RogueSun | C63: Family #7 | D63: 268155 | E63: 24
A64: =A63+1 -> 63 | B64: Ecifircas | C64: Family #1 | D64: 513435 | E64: 23
A65: =A64+1 -> 64 | B65: Monte | C65: Family #30 | D65: 644775 | E65: 22
A66: =A65+1 -> 65 | B66: KiRbYpRiMe | C66: Family #11 | D66: 338054 | E66: 20
A67: =A66+1 -> 66 | B67: ikbenschipper | C67: Family #14 | D67: 285945 | E67: 20
A68: =A67+1 -> 67 | B68: TISO | C68: Family #22 | D68: 235060 | E68: 18
A69: =A68+1 -> 68 | B69: ares86 | C69: Family #8 | D69: 68500 | E69: 18
A70: =A69+1 -> 69 | B70: ComCrap | C70: Family #8 | D70: 384448 | E70: 18
A71: =A70+1 -> 70 | B71: Archangel | C71: Family #11 | D71: 699614 | E71: 18
A72: =A71+1 -> 71 | B72: Crusaders | C72: Family #20 | D72: 1077781 | E72: 17
A73: =A72+1 -> 72 | B73: diz | C73: Family #25 | D73: 80093 | E73: 15
A74: =A73+1 -> 73 | B74: Hetm | C74: Family #11 | D74: 55152 | E74: 14
A75: =A74+1 -> 74 | B75: muhkuh | C75: Family #7 | D75: 367824 | E75: 14
A76: =A75+1 -> 75 | B76: DragonSlayers | C76: Family #1 | D76: 84114 | E76: 13
A77: =A76+1 -> 76 | B77: bl | C77: Family #18 | D77: 65977 | E77: 12
A78: =A77+1 -> 77 | B78: StupidoRice | C78: Family #14 | D78: 147486 | E78: 12
A79: =A78+1 -> 78 | B79: Wonderin | C79: Family #7 | D79: 92109 | E79: 11
A80: =A79+1 -> 79 | B80: XpYRO | C80: Family #8 | D80: 998344 | E80: 11
A81: =A80+1 -> 80 | B81: Cows | C81: Family #22 | D81: 319940 | E81: 11
A82: =A81+1 -> 81 | B82: Sandrolaria | C82: Family #10 | D82: 121922 | E82: 10
A83: =A82+1 -> 82 | B83: Unseen | C83: Family #8 | D83: 2034320 | E83: 10
A84: =A83+1 -> 83 | B84: Floyd | C84: Family #29 | D84: 123632 | E84: 10
A85: =A84+1 -> 84 | B85: meh | C85: Family #23 | D85: 18606 | E85: 9
A86: =A85+1 -> 85 | B86: Gi | C86: Family #17 | D86: 47000 | E86: 8
A87: =A86+1 -> 86 | B87: King | C87: Family #20 | D87: 13037 | E87: 8
A88: =A87+1 -> 87 | B88: Ragnorrok | C88: Family #8 | D88: 67358 | E88: 8
A89: =A88+1 -> 88 | B89: none really | C89: Family #10 | D89: 7063 | E89: 7
A90: =A89+1 -> 89 | B90: Melf | C90: Family #24 | D90: 199704 | E90: 7
A91: =A90+1 -> 90 | B91: Aminion | C91: Family #30 | D91: 323738 | E91: 7
A92: =A91+1 -> 91 | B92: Myt | C92: Family #19 | D92: 17333 | E92: 6
A93: =A92+1 -> 92 | B93: Sol | C93: Family #24 | D93: 20956 | E93: 6
A94: =A93+1 -> 93 | B94: Drago | C94: Family #19 | D94: 142059 | E94: 6
A95: =A94+1 -> 94 | B95: Wind | C95: Family #20 | D95: 41938 | E95: 6
A96: =A95+1 -> 95 | B96: Sogil | C96: Family #12 | D96: 127698 | E96: 6
A97: =A96+1 -> 96 | B97: Elfje | C97: Family #19 | D97: 15122 | E97: 5
A98: =A97+1 -> 97 | B98: Chaoszone | C98: Family #27 | D98: 7260 | E98: 5
A99: =A98+1 -> 98 | B99: twisted ones | C99: Family #23 | D99: 128592 | E99: 4
A100: =A99+1 -> 99 | B100: sepulnation | C100: Family #8 | D100: 10761 | E100: 4
A101: =A100+1 -> 100 | B101: roya | C101: Family #14 | D101: 10201 | E101: 3
A102: =A101+1 -> 101 | B102: Kro | C102: Family #18 | D102: 5608 | E102: 3
A103: =A102+1 -> 102 | B103: ik | C103: Family #18 | D103: 13701 | E103: 3
A104: =A103+1 -> 103 | B104: Tria | C104: Family #30 | D104: 55305 | E104: 3
A105: =A104+1 -> 104 | B105: DamnedPlace | C105: Family #31 | D105: 5697 | E105: 3
A106: =A105+1 -> 105 | B106: bla | C106: Family #10 | D106: 8831 | E106: 3
A107: =A106+1 -> 106 | B107: The killer E | C107: Family #5 | D107: 2544 | E107: 2
A108: =A107+1 -> 107 | B108: Ihatepants | C108: Family #13 | D108: 8764 | E108: 2
A109: =A108+1 -> 108 | B109: T-BOMB | C109: Family #13 | D109: 14575 | E109: 2
A110: =A109+1 -> 109 | B110: Joker | C110: Family #13 | D110: 4396 | E110: 2
A111: =A110+1 -> 110 | B111: jepunos | C111: Family #4 | D111: 6580 | E111: 2
A112: =A111+1 -> 111 | B112: Wamphyri | C112: Family #0 | D112: 3393 | E112: 2
A113: =A112+1 -> 112 | B113: Optical Illusions | C113: Family #29 | D113: 23586 | E113: 2
A114: =A113+1 -> 113 | B114: Sela | C114: Family #23 | D114: 3893 | E114: 2
A115: =A114+1 -> 114 | B115: LuStE | C115: Family #18 | D115: 3060 | E115: 1
A116: =A115+1 -> 115 | B116: Carps | C116: Family #31 | D116: 1740 | E116: 1
A117: =A116+1 -> 116 | B117: se | C117: Family #11 | D117: 2660 | E117: 1
A118: =A117+1 -> 117 | B118: Demon | C118: Family #19 | D118: 3340 | E118: 1
A119: =A118+1 -> 118 | B119: Fat_ | C119: Family #3 | D119: 1740 | E119: 1
A120: =A119+1 -> 119 | B120: shun | C120: Family #25 | D120: 7449 | E120: 1
A121: =A120+1 -> 120 | B121: blueover | C121: Family #4 | D121: 1740 | E121: 1
A122: =A121+1 -> 121 | B122: Darq | C122: Family #19 | D122: 1740 | E122: 1
A123: =A122+1 -> 122 | B123: Black | C123: Family #19 | D123: 2490 | E123: 1
A124: =A123+1 -> 123 | B124: Lsdfgesliebeersf | C124: Family #27 | D124: 1740 | E124: 1
A125: =A124+1 -> 124 | B125: The U | C125: Family #1 | D125: 9060 | E125: 1
A126: =A125+1 -> 125 | B126: Parasites | C126: Family #19 | D126: 4424 | E126: 1
A127: =A126+1 -> 126 | B127: wizardgandalf | C127: Family #19 | D127: 4545 | E127: 1
A128: =A127+1 -> 127 | B128: The Ed | C128: Family #18 | D128: 1740 | E128: 1
A129: =A128+1 -> 128 | B129: Amok | C129: Family #11 | D129: 1740 | E129: 1
A130: =A129+1 -> 129 | B130: Fed | C130: Family #14 | D130: 1740 | E130: 1
A131: =A130+1 -> 130 | B131: wadwa | C131: Family #17 | D131: 1740 | E131: 1
A132: =A131+1 -> 131 | B132: TU | C132: Family #8 | D132: 1742 | E132: 1
A133: =A132+1 -> 132 | B133: Flint Fireforge | C133: Family #7 | D133: 6697 | E133: 1
A134: =A133+1 -> 133 | B134: Holy | C134: Family #28 | D134: 1740 | E134: 1
A135: =A134+1 -> 134 | B135: Kr | C135: Family #14 | D135: 1740 | E135: 1
A136: =A135+1 -> 135 | B136: Xandunia | C136: Family #11 | D136: 1740 | E136: 1
A137: =A136+1 -> 136 | B137: io | C137: Family #18 | D137: 1740 | E137: 1
A138: =A137+1 -> 137 | B138: il | C138: Family #18 | D138: 4540 | E138: 1
A139: =A138+1 -> 138 | B139: Odin | C139: Family #30 | D139: 7039 | E139: 1
A140: =A139+1 -> 139 | B140: Ev | C140: Family #16 | D140: 1740 | E140: 1
A141: =A140+1 -> 140 | B141: Evi | C141: Family #23 | D141: 1740 | E141: 1
A142: =A141+1 -> 141 | B142: peop | C142: Family #25 | D142: 10900 | E142: 1
A143: =A142+1 -> 142 | B143: SSBM | C143: Family #15 | D143: 3070 | E143: 1
A144: =A143+1 -> 143 | B144: qads | C144: Family #4 | D144: 1740 | E144: 1
A145: =A144+1 -> 144 | B145: BelgianTerror | C145: Family #1 | D145: 9593 | E145: 1
A146: =A145+1 -> 145 | B146: TiGeR-NoW | C146: Family #18 | D146: 1740 | E146: 1
A147: =A146+1 -> 146 | B147: x8wg3h7 | C147: Family #18 | D147: 2212 | E147: 1
A148: =A147+1 -> 147 | B148: best | C148: Family #10 | D148: 2756 | E148: 1
A149: =A148+1 -> 148 | B149: Trantor Mir | C149: Family #18 | D149: 21237 | E149: 1
A150: =A149+1 -> 149 | B150: Allied Resistance | C150: Family #0 | D150: 2300 | E150: 1
A151: =A150+1 -> 150 | B151: Hogland | C151: Family #11 | D151: 5130 | E151: 1
A152: =A151+1 -> 151 | B152: warmon_minions | C152: Family #29 | D152: 1759 | E152: 1
A153: =A152+1 -> 152 | B153: hawaiians | C153: Family #24 | D153: 3332 | E153: 1
A154: =A153+1 -> 153 | B154: Terra | C154: Family #4 | D154: 1740 | E154: 1
A155: =A154+1 -> 154 | B155: Planet | C155: Family #26 | D155: 3101 | E155: 1
A156: =A155+1 -> 155 | B156: MightyPetrus | C156: Family #18 | D156: 1876 | E156: 1
A157: =A156+1 -> 156 | B157: Lupo | C157: Family #27 | D157: 2480 | E157: 1
A158: =A157+1 -> 157 | B158: Marx | C158: Family #7 | D158: 1740 | E158: 1
A159: =A158+1 -> 158 | B159: Ketaros | C159: Family #1 | D159: 1740 | E159: 1
A160: =A159+1 -> 159 | B160: MTM | C160: Family #26 | D160: 28448 | E160: 1
A161: =A160+1 -> 160 | B161: Falconian | C161: Family #24 | D161: 10768 | E161: 1
A162: =A161+1 -> 161 | B162: Nexia | C162: Family #2 | D162: 9325 | E162: 1
A163: =A162+1 -> 162 | B163: baloeran | C163: Family #28 | D163: 1740 | E163: 1
A164: =A163+1 -> 163 | B164: Killer Rath | C164: Family #10 | D164: 4140 | E164: 1
A165: =A164+1 -> 164 | B165: Amish Penguin | C165: Family #10 | D165: 4140 | E165: 1
A166: =A165+1 -> 165 | B166: CG | C166: Family #14 | D166: 1740 | E166: 1
A167: =A166+1 -> 166 | B167: Hello World | C167: Family #20 | D167: 1740 | E167: 1
A168: =A167+1 -> 167 | B168: theSCHIZOphrenICs | C168: Family #9 | D168: 1740 | E168: 1
A169: =A168+1 -> 168 | B169: Sardukar | C169: Family #0 | D169: 3609 | E169: 1
A170: =A169+1 -> 169 | B170: Rivvy | C170: Family #19 | D170: 2350 | E170: 1
A171: =A170+1 -> 170 | B171: Iliad | C171: Family #6 | D171: 1740 | E171: 1
A172: =A171+1 -> 171 | B172: The Galbadian Empire | C172: Family #11 | D172: 1740 | E172: 1
A173: =A172+1 -> 172 | B173: Foolish Fobbahs | C173: Family #28 | D173: 1740 | E173: 1
A174: =A173+1 -> 173 | B174: Paradisia | C174: Family #0 | D174: 1740 | E174: 1
A175: =A174+1 -> 174 | B175: Tobi | C175: Family #2 | D175: 5000 | E175: 1
A176: =A175+1 -> 175 | B176: Yanks27thlegion | C176: Family #8 | D176: 1740 | E176: 1
A177: =A176+1 -> 176 | B177: Hysteria | C177: Family #10 | D177: 1100 | E177: 1
A178: =A177+1 -> 177 | B178: IeatSIMON4BREAKFAST | C178: Family #29 | D178: 27277 | E178: 1
A179: =A178+1 -> 178 | B179: Knighthood | C179: Family #20 | D179: 1740 | E179: 1
A180: =A179+1 -> 179 | B180: So | C180: Family #23 | D180: 2100 | E180: 1
A181: =A180+1 -> 180 | B181: TheBlackCompany | C181: Family #15 | D181: 3100 | E181: 1
A182: =A181+1 -> 181 | B182: LordsOfChaos | C182: Family #30 | D182: 1710 | E182: 1
A183: =A182+1 -> 182 | B183: Fox | C183: Family #13 | D183: 1740 | E183: 1
A184: =A183+1 -> 183 | B184: Sinister | C184: Family #15 | D184: 1520170 | E184: 1
A185: =A184+1 -> 184 | B185: Mainframe | C185: Family #16 | D185: 1740 | E185: 1
A186: =A185+1 -> 185 | B186: Marodeur | C186: Family #7 | D186: 413319 | E186: 1
A187: =A186+1 -> 186 | B187: NoRpLaNdS | C187: Family #11 | D187: 2700 | E187: 1
A188: =A187+1 -> 187 | B188: yebana v rot | C188: Family #0 | D188: 3510 | E188: 1
A189: =A188+1 -> 188 | B189: wack | C189: Family #6 | D189: 1740 | E189: 1