A1: Rank | B1: Player | C1: Family | D1: Planets | E1: Networth
A2: 1 | B2: Xxit | C2: Family #9 | D2: 144 | E2: 7425771
A3: =A2+1 -> 2 | B3: Flegel | C3: Family #9 | D3: 140 | E3: 5166518
A4: =A3+1 -> 3 | B4: Greatic | C4: Family #9 | D4: 132 | E4: 3243904
A5: =A4+1 -> 4 | B5: Nemawise | C5: Family #9 | D5: 88 | E5: 2594646
A6: =A5+1 -> 5 | B6: prisma | C6: Family #3 | D6: 99 | E6: 2432512
A7: =A6+1 -> 6 | B7: jizames | C7: Family #19 | D7: 98 | E7: 2112891
A8: =A7+1 -> 7 | B8: Evilbunny | C8: Family #9 | D8: 107 | E8: 1855706
A9: =A8+1 -> 8 | B9: Devilsempire | C9: Family #18 | D9: 67 | E9: 1689654
A10: =A9+1 -> 9 | B10: a book of grinches | C10: Family #21 | D10: 112 | E10: 1672774
A11: =A10+1 -> 10 | B11: The Grinch | C11: Family #21 | D11: 72 | E11: 1653602
A12: =A11+1 -> 11 | B12: Radio Active | C12: Family #22 | D12: 83 | E12: 1614250
A13: =A12+1 -> 12 | B13: Singidunum | C13: Family #9 | D13: 71 | E13: 1602109
A14: =A13+1 -> 13 | B14: SCoRPioN EMPiRe | C14: Family #18 | D14: 72 | E14: 1412665
A15: =A14+1 -> 14 | B15: The Cat in The Hat | C15: Family #21 | D15: 58 | E15: 1338519
A16: =A15+1 -> 15 | B16: Doomsville | C16: Family #22 | D16: 44 | E16: 1245930
A17: =A16+1 -> 16 | B17: Miirshak | C17: Family #22 | D17: 91 | E17: 1237273
A18: =A17+1 -> 17 | B18: silentbobs | C18: Family #10 | D18: 47 | E18: 1085794
A19: =A18+1 -> 18 | B19: Sogil | C19: Family #22 | D19: 95 | E19: 1084918
A20: =A19+1 -> 19 | B20: Daydreamer | C20: Family #23 | D20: 37 | E20: 1072452
A21: =A20+1 -> 20 | B21: Multi | C21: Family #13 | D21: 81 | E21: 1069682
A22: =A21+1 -> 21 | B22: kingOfBongo | C22: Family #3 | D22: 45 | E22: 1009033
A23: =A22+1 -> 22 | B23: ordos234_planets | C23: Family #8 | D23: 59 | E23: 981504
A24: =A23+1 -> 23 | B24: Young Link | C24: Family #18 | D24: 83 | E24: 923399
A25: =A24+1 -> 24 | B25: Behold My Soul | C25: Family #3 | D25: 48 | E25: 920552
A26: =A25+1 -> 25 | B26: The Lorax | C26: Family #21 | D26: 54 | E26: 906340
A27: =A26+1 -> 26 | B27: serialkilla | C27: Family #18 | D27: 62 | E27: 832372
A28: =A27+1 -> 27 | B28: Attila | C28: Family #14 | D28: 31 | E28: 771294
A29: =A28+1 -> 28 | B29: Null | C29: Family #0 | D29: 66 | E29: 743529
A30: =A29+1 -> 29 | B30: Aragorn | C30: Family #10 | D30: 69 | E30: 725899
A31: =A30+1 -> 30 | B31: Napalm | C31: Family #14 | D31: 59 | E31: 712598
A32: =A31+1 -> 31 | B32: SINNERS | C32: Family #18 | D32: 41 | E32: 658029
A33: =A32+1 -> 32 | B33: Bastillion of Death | C33: Family #23 | D33: 37 | E33: 596608
A34: =A33+1 -> 33 | B34: The Butcher | C34: Family #6 | D34: 68 | E34: 586238
A35: =A34+1 -> 34 | B35: Appeltje | C35: Family #23 | D35: 60 | E35: 576322
A36: =A35+1 -> 35 | B36: MassKilling | C36: Family #2 | D36: 42 | E36: 563671
A37: =A36+1 -> 36 | B37: a stripe cat | C37: Family #21 | D37: 42 | E37: 556874
A38: =A37+1 -> 37 | B38: sathuli | C38: Family #13 | D38: 46 | E38: 552858
A39: =A38+1 -> 38 | B39: Multiple | C39: Family #5 | D39: 50 | E39: 547152
A40: =A39+1 -> 39 | B40: Sandrolaria | C40: Family #19 | D40: 14 | E40: 541012
A41: =A40+1 -> 40 | B41: SatansArmy | C41: Family #22 | D41: 31 | E41: 499734
A42: =A41+1 -> 41 | B42: subtext | C42: Family #3 | D42: 30 | E42: 498635
A43: =A42+1 -> 42 | B43: World_of_Ices | C43: Family #4 | D43: 48 | E43: 493082
A44: =A43+1 -> 43 | B44: Zeratel | C44: Family #12 | D44: 46 | E44: 482043
A45: =A44+1 -> 44 | B45: Fallout | C45: Family #22 | D45: 34 | E45: 476326
A46: =A45+1 -> 45 | B46: Thunder | C46: Family #10 | D46: 35 | E46: 476168
A47: =A46+1 -> 46 | B47: Grumpfparade | C47: Family #19 | D47: 27 | E47: 455950
A48: =A47+1 -> 47 | B48: Bluebeards Taking | C48: Family #22 | D48: 46 | E48: 438852
A49: =A48+1 -> 48 | B49: Shining Force | C49: Family #2 | D49: 40 | E49: 416104
A50: =A49+1 -> 49 | B50: Blade | C50: Family #23 | D50: 49 | E50: 415388
A51: =A50+1 -> 50 | B51: noobie | C51: Family #16 | D51: 35 | E51: 398570
A52: =A51+1 -> 51 | B52: centauri | C52: Family #2 | D52: 45 | E52: 394366
A53: =A52+1 -> 52 | B53: Luster | C53: Family #18 | D53: 52 | E53: 394295
A54: =A53+1 -> 53 | B54: elerian | C54: Family #6 | D54: 26 | E54: 375807
A55: =A54+1 -> 54 | B55: Blood Of Thieves | C55: Family #8 | D55: 46 | E55: 364004
A56: =A55+1 -> 55 | B56: AmericA | C56: Family #10 | D56: 29 | E56: 355036
A57: =A56+1 -> 56 | B57: Kiyan | C57: Family #16 | D57: 40 | E57: 353464
A58: =A57+1 -> 57 | B58: boogje | C58: Family #18 | D58: 62 | E58: 347622
A59: =A58+1 -> 58 | B59: Serial Killa | C59: Family #13 | D59: 45 | E59: 345821
A60: =A59+1 -> 59 | B60: hip-hop empire | C60: Family #10 | D60: 42 | E60: 340951
A61: =A60+1 -> 60 | B61: Intension | C61: Family #5 | D61: 35 | E61: 329339
A62: =A61+1 -> 61 | B62: exit12 | C62: Family #19 | D62: 39 | E62: 318191
A63: =A62+1 -> 62 | B63: dizzian | C63: Family #20 | D63: 38 | E63: 315771
A64: =A63+1 -> 63 | B64: DragonsFury | C64: Family #10 | D64: 13 | E64: 315078
A65: =A64+1 -> 64 | B65: Kiwis | C65: Family #8 | D65: 34 | E65: 314356
A66: =A65+1 -> 65 | B66: Dominator | C66: Family #7 | D66: 46 | E66: 299313
A67: =A66+1 -> 66 | B67: Can I Build Laser Traps | C67: Family #21 | D67: 35 | E67: 283896
A68: =A67+1 -> 67 | B68: hell hell | C68: Family #14 | D68: 45 | E68: 279814
A69: =A68+1 -> 68 | B69: Bricks | C69: Family #9 | D69: 46 | E69: 279529
A70: =A69+1 -> 69 | B70: Wizard CaT | C70: Family #15 | D70: 25 | E70: 278869
A71: =A70+1 -> 70 | B71: DarkReaver | C71: Family #6 | D71: 32 | E71: 260331
A72: =A71+1 -> 71 | B72: Outworld | C72: Family #5 | D72: 30 | E72: 257422
A73: =A72+1 -> 72 | B73: TISO | C73: Family #15 | D73: 38 | E73: 226446
A74: =A73+1 -> 73 | B74: Rebel | C74: Family #15 | D74: 38 | E74: 218983
A75: =A74+1 -> 74 | B75: Grasshopper | C75: Family #2 | D75: 33 | E75: 207294
A76: =A75+1 -> 75 | B76: the maniac | C76: Family #6 | D76: 27 | E76: 194177
A77: =A76+1 -> 76 | B77: pants | C77: Family #0 | D77: 41 | E77: 187002
A78: =A77+1 -> 77 | B78: John_Mullins | C78: Family #8 | D78: 16 | E78: 175524
A79: =A78+1 -> 78 | B79: Apollyon | C79: Family #11 | D79: 41 | E79: 170592
A80: =A79+1 -> 79 | B80: Elisti | C80: Family #1 | D80: 17 | E80: 168594
A81: =A80+1 -> 80 | B81: Monte | C81: Family #14 | D81: 17 | E81: 168405
A82: =A81+1 -> 81 | B82: Lazzzzy | C82: Family #7 | D82: 36 | E82: 165992
A83: =A82+1 -> 82 | B83: ICE | C83: Family #11 | D83: 38 | E83: 165448
A84: =A83+1 -> 83 | B84: Dookie | C84: Family #10 | D84: 25 | E84: 161732
A85: =A84+1 -> 84 | B85: BRANDY | C85: Family #18 | D85: 21 | E85: 154062
A86: =A85+1 -> 85 | B86: Crusaders | C86: Family #20 | D86: 18 | E86: 149315
A87: =A86+1 -> 86 | B87: just someone | C87: Family #13 | D87: 19 | E87: 144214
A88: =A87+1 -> 87 | B88: WEC | C88: Family #15 | D88: 23 | E88: 139552
A89: =A88+1 -> 88 | B89: giriama | C89: Family #15 | D89: 25 | E89: 135103
A90: =A89+1 -> 89 | B90: Malina | C90: Family #7 | D90: 20 | E90: 134557
A91: =A90+1 -> 90 | B91: Haribo | C91: Family #2 | D91: 27 | E91: 119787
A92: =A91+1 -> 91 | B92: Yugo the king | C92: Family #2 | D92: 21 | E92: 110021
A93: =A92+1 -> 92 | B93: Death to everyone | C93: Family #1 | D93: 18 | E93: 104476
A94: =A93+1 -> 93 | B94: MakaRaizeR | C94: Family #12 | D94: 38 | E94: 101553
A95: =A94+1 -> 94 | B95: Erazor | C95: Family #4 | D95: 18 | E95: 97738
A96: =A95+1 -> 95 | B96: Painy | C96: Family #9 | D96: 11 | E96: 95291
A97: =A96+1 -> 96 | B97: Skyff | C97: Family #12 | D97: 22 | E97: 93221
A98: =A97+1 -> 97 | B98: Xsasinator | C98: Family #16 | D98: 18 | E98: 92852
A99: =A98+1 -> 98 | B99: Crucifix | C99: Family #11 | D99: 8 | E99: 89540
A100: =A99+1 -> 99 | B100: Distruction | C100: Family #17 | D100: 13 | E100: 87801
A101: =A100+1 -> 100 | B101: Alfa Centauri | C101: Family #6 | D101: 14 | E101: 83600
A102: =A101+1 -> 101 | B102: Wind | C102: Family #19 | D102: 23 | E102: 80489
A103: =A102+1 -> 102 | B103: Scantraxx | C103: Family #17 | D103: 10 | E103: 80443
A104: =A103+1 -> 103 | B104: Azrael | C104: Family #13 | D104: 14 | E104: 74185
A105: =A104+1 -> 104 | B105: Deuscrim | C105: Family #19 | D105: 17 | E105: 73681
A106: =A105+1 -> 105 | B106: Joker | C106: Family #23 | D106: 12 | E106: 70137
A107: =A106+1 -> 106 | B107: Floyd | C107: Family #6 | D107: 15 | E107: 67229
A108: =A107+1 -> 107 | B108: Florentine | C108: Family #10 | D108: 10 | E108: 67161
A109: =A108+1 -> 108 | B109: RiotingVirus | C109: Family #14 | D109: 11 | E109: 60997
A110: =A109+1 -> 109 | B110: Ian | C110: Family #19 | D110: 5 | E110: 56978
A111: =A110+1 -> 110 | B111: mm | C111: Family #23 | D111: 7 | E111: 56627
A112: =A111+1 -> 111 | B112: TD | C112: Family #0 | D112: 26 | E112: 56276
A113: =A112+1 -> 112 | B113: manowar | C113: Family #1 | D113: 15 | E113: 55736
A114: =A113+1 -> 113 | B114: Falcatron | C114: Family #20 | D114: 15 | E114: 52606
A115: =A114+1 -> 114 | B115: Dripping Green Load | C115: Family #16 | D115: 26 | E115: 52280
A116: =A115+1 -> 115 | B116: IEATSPAM | C116: Family #7 | D116: 8 | E116: 51384
A117: =A116+1 -> 116 | B117: I lost my underwear | C117: Family #21 | D117: 15 | E117: 47969
A118: =A117+1 -> 117 | B118: TempleOfSyrinx | C118: Family #4 | D118: 11 | E118: 47585
A119: =A118+1 -> 118 | B119: solus | C119: Family #16 | D119: 10 | E119: 46386
A120: =A119+1 -> 119 | B120: shinobi | C120: Family #2 | D120: 15 | E120: 43911
A121: =A120+1 -> 120 | B121: Ulti | C121: Family #0 | D121: 17 | E121: 41429
A122: =A121+1 -> 121 | B122: Sheep | C122: Family #19 | D122: 6 | E122: 39385
A123: =A122+1 -> 122 | B123: BigOld | C123: Family #20 | D123: 18 | E123: 39048
A124: =A123+1 -> 123 | B124: Lost empire | C124: Family #6 | D124: 10 | E124: 37158
A125: =A124+1 -> 124 | B125: Grom hellscream | C125: Family #14 | D125: 22 | E125: 36858
A126: =A125+1 -> 125 | B126: Abyss of The loss | C126: Family #20 | D126: 4 | E126: 33643
A127: =A126+1 -> 126 | B127: Ice_Killer | C127: Family #11 | D127: 9 | E127: 31617
A128: =A127+1 -> 127 | B128: Link | C128: Family #4 | D128: 3 | E128: 31006
A129: =A128+1 -> 128 | B129: Wolfbane | C129: Family #17 | D129: 6 | E129: 26175
A130: =A129+1 -> 129 | B130: Barrayar | C130: Family #8 | D130: 9 | E130: 25270
A131: =A130+1 -> 130 | B131: Jaqadai | C131: Family #4 | D131: 3 | E131: 21737
A132: =A131+1 -> 131 | B132: soccer dude | C132: Family #12 | D132: 9 | E132: 19565
A133: =A132+1 -> 132 | B133: Seriph | C133: Family #16 | D133: 3 | E133: 19162
A134: =A133+1 -> 133 | B134: darkforces | C134: Family #17 | D134: 7 | E134: 17544
A135: =A134+1 -> 134 | B135: Betrow00tage | C135: Family #1 | D135: 7 | E135: 17289
A136: =A135+1 -> 135 | B136: sleep | C136: Family #15 | D136: 6 | E136: 16386
A137: =A136+1 -> 136 | B137: Seed | C137: Family #5 | D137: 2 | E137: 16047
A138: =A137+1 -> 137 | B138: EV_zz | C138: Family #16 | D138: 2 | E138: 15295
A139: =A138+1 -> 138 | B139: wack | C139: Family #7 | D139: 5 | E139: 13909
A140: =A139+1 -> 139 | B140: turkeyDoner | C140: Family #20 | D140: 13 | E140: 13516
A141: =A140+1 -> 140 | B141: incubus | C141: Family #11 | D141: 3 | E141: 12889
A142: =A141+1 -> 141 | B142: Killer Bug | C142: Family #5 | D142: 3 | E142: 12642
A143: =A142+1 -> 142 | B143: platonia | C143: Family #3 | D143: 2 | E143: 11958
A144: =A143+1 -> 143 | B144: the big bad meiane | C144: Family #8 | D144: 5 | E144: 11046
A145: =A144+1 -> 144 | B145: AeTas | C145: Family #3 | D145: 8 | E145: 10240
A146: =A145+1 -> 145 | B146: Grey Knights | C146: Family #15 | D146: 7 | E146: 9850
A147: =A146+1 -> 146 | B147: Elfje | C147: Family #5 | D147: 1 | E147: 9775
A148: =A147+1 -> 147 | B148: Raven | C148: Family #23 | D148: 3 | E148: 8752
A149: =A148+1 -> 148 | B149: BRASIL | C149: Family #1 | D149: 7 | E149: 8591
A150: =A149+1 -> 149 | B150: Talic | C150: Family #8 | D150: 3 | E150: 8447
A151: =A150+1 -> 150 | B151: Captain_bob | C151: Family #0 | D151: 7 | E151: 8213
A152: =A151+1 -> 151 | B152: IbEsTaNk | C152: Family #0 | D152: 3 | E152: 7888
A153: =A152+1 -> 152 | B153: Valleyman | C153: Family #7 | D153: 3 | E153: 7402
A154: =A153+1 -> 153 | B154: Magrathea | C154: Family #13 | D154: 2 | E154: 7192
A155: =A154+1 -> 154 | B155: ghosts | C155: Family #11 | D155: 2 | E155: 5885
A156: =A155+1 -> 155 | B156: sollenoposis | C156: Family #13 | D156: 3 | E156: 5848
A157: =A156+1 -> 156 | B157: Nowhere Land | C157: Family #1 | D157: 3 | E157: 5725
A158: =A157+1 -> 157 | B158: Drunk | C158: Family #7 | D158: 5 | E158: 5435
A159: =A158+1 -> 158 | B159: boogjeuh | C159: Family #5 | D159: 1 | E159: 5082
A160: =A159+1 -> 159 | B160: Hello | C160: Family #4 | D160: 3 | E160: 4939
A161: =A160+1 -> 160 | B161: WTF | C161: Family #20 | D161: 2 | E161: 4904
A162: =A161+1 -> 161 | B162: Haribo11 | C162: Family #1 | D162: 4 | E162: 4894
A163: =A162+1 -> 162 | B163: Vengy | C163: Family #8 | D163: 3 | E163: 4756
A164: =A163+1 -> 163 | B164: Roxeanne | C164: Family #17 | D164: 3 | E164: 4735
A165: =A164+1 -> 164 | B165: Deztroyer | C165: Family #23 | D165: 1 | E165: 4650
A166: =A165+1 -> 165 | B166: Threeheaded Monkey AG | C166: Family #15 | D166: 2 | E166: 3958
A167: =A166+1 -> 166 | B167: A Cat In The Hat | C167: Family #21 | D167: 3 | E167: 3944
A168: =A167+1 -> 167 | B168: Constipation | C168: Family #4 | D168: 1 | E168: 3902
A169: =A168+1 -> 168 | B169: No_Clue | C169: Family #3 | D169: 2 | E169: 3576
A170: =A169+1 -> 169 | B170: Evil | C170: Family #17 | D170: 1 | E170: 3532
A171: =A170+1 -> 170 | B171: hooraa | C171: Family #0 | D171: 1 | E171: 3449
A172: =A171+1 -> 171 | B172: Demonic | C172: Family #0 | D172: 1 | E172: 3447
A173: =A172+1 -> 172 | B173: Uruk Hai | C173: Family #14 | D173: 2 | E173: 3405
A174: =A173+1 -> 173 | B174: Angels | C174: Family #5 | D174: 1 | E174: 3180
A175: =A174+1 -> 174 | B175: master | C175: Family #14 | D175: 1 | E175: 3060
A176: =A175+1 -> 175 | B176: soRKaz | C176: Family #22 | D176: 1 | E176: 2796
A177: =A176+1 -> 176 | B177: Ace | C177: Family #12 | D177: 1 | E177: 2540
A178: =A177+1 -> 177 | B178: FallenAngels | C178: Family #16 | D178: 1 | E178: 2540
A179: =A178+1 -> 178 | B179: donination | C179: Family #7 | D179: 1 | E179: 2394
A180: =A179+1 -> 179 | B180: Goat | C180: Family #2 | D180: 1 | E180: 2300
A181: =A180+1 -> 180 | B181: DarkMonk8 | C181: Family #13 | D181: 1 | E181: 2280
A182: =A181+1 -> 181 | B182: rivan | C182: Family #17 | D182: 1 | E182: 2220
A183: =A182+1 -> 182 | B183: GVD | C183: Family #12 | D183: 1 | E183: 2157
A184: =A183+1 -> 183 | B184: Merris | C184: Family #3 | D184: 1 | E184: 2060
A185: =A184+1 -> 184 | B185: Billy_BoyZ | C185: Family #17 | D185: 1 | E185: 2060
A186: =A185+1 -> 185 | B186: The Holy Sanctuary | C186: Family #20 | D186: 1 | E186: 1882
A187: =A186+1 -> 186 | B187: Orklands | C187: Family #6 | D187: 1 | E187: 1826
A188: =A187+1 -> 187 | B188: the nobodies | C188: Family #1 | D188: 1 | E188: 1770
A189: =A188+1 -> 188 | B189: Tetragrammation | C189: Family #12 | D189: 1 | E189: 1759
A190: =A189+1 -> 189 | B190: BOEH | C190: Family #12 | D190: 1 | E190: 1759
A191: =A190+1 -> 190 | B191: PAPER EMPIRE | C191: Family #11 | D191: 1 | E191: 1740
A192: =A191+1 -> 191 | B192: DracoNight | C192: Family #11 | D192: 1 | E192: 1740
A193: =A192+1 -> 192 | B193: Painkiller | C193: Family #4 | D193: 1 | E193: 1740