A1: Rank | B1: Player | C1: Family | D1: Networth | E1: Planets
A2: 1 | B2: SmallKwyzanny | C2: Family #25 | D2: 216949625 | E2: 606
A3: =A2+1 -> 2 | B3: Knight Yang | C3: Family #17 | D3: 38632908 | E3: 399
A4: =A3+1 -> 3 | B4: BeholdMySoul | C4: Family #19 | D4: 14873982 | E4: 264
A5: =A4+1 -> 4 | B5: valleyman | C5: Family #13 | D5: 10354603 | E5: 250
A6: =A5+1 -> 5 | B6: BelgianTerror | C6: Family #4 | D6: -1721204 | E6: 238
A7: =A6+1 -> 6 | B7: MacinTrash | C7: Family #20 | D7: 16651602 | E7: 222
A8: =A7+1 -> 7 | B8: NoRpLaNdS | C8: Family #8 | D8: 15188978 | E8: 215
A9: =A8+1 -> 8 | B9: Crucifucks | C9: Family #29 | D9: 7586116 | E9: 202
A10: =A9+1 -> 9 | B10: Devilsempire | C10: Family #26 | D10: 2630318 | E10: 200
A11: =A10+1 -> 10 | B11: Dazists | C11: Family #22 | D11: 1208853483 | E11: 122
A12: =A11+1 -> 11 | B12: Wolfen | C12: Family #1 | D12: 10393949 | E12: 112
A13: =A12+1 -> 12 | B13: SmokingBunnies | C13: Family #3 | D13: 6424931 | E13: 108
A14: =A13+1 -> 13 | B14: The_Borg | C14: Family #10 | D14: 7433278 | E14: 85
A15: =A14+1 -> 14 | B15: Land of Smash | C15: Family #28 | D15: 7679834 | E15: 75
A16: =A15+1 -> 15 | B16: Mandragoran | C16: Family #26 | D16: 2754020 | E16: 72
A17: =A16+1 -> 16 | B17: Sela | C17: Family #12 | D17: 2573186 | E17: 70
A18: =A17+1 -> 17 | B18: Starfury | C18: Family #27 | D18: 4171826 | E18: 68
A19: =A18+1 -> 18 | B19: Gos | C19: Family #8 | D19: 5213327 | E19: 65
A20: =A19+1 -> 19 | B20: flegel | C20: Family #30 | D20: 2721330 | E20: 61
A21: =A20+1 -> 20 | B21: Sogil | C21: Family #21 | D21: 13877064 | E21: 52
A22: =A21+1 -> 21 | B22: Falconian | C22: Family #24 | D22: 4261956 | E22: 51
A23: =A22+1 -> 22 | B23: Hawaiianking | C23: Family #24 | D23: -2201464 | E23: 50
A24: =A23+1 -> 23 | B24: Sash | C24: Family #12 | D24: 673451 | E24: 46
A25: =A24+1 -> 24 | B25: Ecifircas | C25: Family #8 | D25: 1831130 | E25: 45
A26: =A25+1 -> 25 | B26: elerian | C26: Family #5 | D26: 159599 | E26: 45
A27: =A26+1 -> 26 | B27: ArEs86 | C27: Family #5 | D27: 936543 | E27: 44
A28: =A27+1 -> 27 | B28: darkforces | C28: Family #1 | D28: 1404522 | E28: 43
A29: =A28+1 -> 28 | B29: Deztroyer | C29: Family #16 | D29: 967495 | E29: 40
A30: =A29+1 -> 29 | B30: SCoRPioN KiNGDoM | C30: Family #12 | D30: 753244 | E30: 36
A31: =A30+1 -> 30 | B31: solle | C31: Family #29 | D31: 691904 | E31: 36
A32: =A31+1 -> 31 | B32: KerrDom | C32: Family #15 | D32: 1098297 | E32: 33
A33: =A32+1 -> 32 | B33: DaKillamanjara | C33: Family #21 | D33: 1700929 | E33: 30
A34: =A33+1 -> 33 | B34: Xpire | C34: Family #5 | D34: 1096388 | E34: 29
A35: =A34+1 -> 34 | B35: FearMYWraith | C35: Family #30 | D35: 3046548 | E35: 28
A36: =A35+1 -> 35 | B36: KaZaA | C36: Family #0 | D36: 847498 | E36: 27
A37: =A36+1 -> 36 | B37: Mortis | C37: Family #14 | D37: 300477 | E37: 27
A38: =A37+1 -> 37 | B38: sardukar | C38: Family #22 | D38: 2512513 | E38: 24
A39: =A38+1 -> 38 | B39: XpYRO | C39: Family #27 | D39: 2133850 | E39: 23
A40: =A39+1 -> 39 | B40: Kudos | C40: Family #9 | D40: 662366 | E40: 23
A41: =A40+1 -> 40 | B41: Silver Assasins | C41: Family #31 | D41: 694919 | E41: 22
A42: =A41+1 -> 41 | B42: Limburg | C42: Family #15 | D42: 606894 | E42: 21
A43: =A42+1 -> 42 | B43: Arch Angel Gabriel | C43: Family #14 | D43: 439394 | E43: 21
A44: =A43+1 -> 43 | B44: Force Edge | C44: Family #21 | D44: 863330 | E44: 18
A45: =A44+1 -> 44 | B45: dunno | C45: Family #22 | D45: 575719 | E45: 18
A46: =A45+1 -> 45 | B46: ikbenschipper | C46: Family #14 | D46: 226562 | E46: 18
A47: =A46+1 -> 46 | B47: THORsAreUs | C47: Family #15 | D47: 2150563 | E47: 17
A48: =A47+1 -> 47 | B48: DarkWorld | C48: Family #5 | D48: 32315 | E48: 17
A49: =A48+1 -> 48 | B49: Betrohemia | C49: Family #1 | D49: 653427 | E49: 16
A50: =A49+1 -> 49 | B50: DeepSouth | C50: Family #22 | D50: 96691 | E50: 16
A51: =A50+1 -> 50 | B51: Cypherus | C51: Family #15 | D51: 42970 | E51: 13
A52: =A51+1 -> 51 | B52: wisp | C52: Family #15 | D52: 54264 | E52: 12
A53: =A52+1 -> 52 | B53: Daydreamer | C53: Family #20 | D53: 18609 | E53: 10
A54: =A53+1 -> 53 | B54: Sinister Urge | C54: Family #21 | D54: 1062414 | E54: 9
A55: =A54+1 -> 54 | B55: The Ninja-Star Rescue Squad | C55: Family #3 | D55: 278334 | E55: 9
A56: =A55+1 -> 55 | B56: Canni | C56: Family #19 | D56: 221324 | E56: 9
A57: =A56+1 -> 56 | B57: Phloydian One | C57: Family #16 | D57: 46277 | E57: 9
A58: =A57+1 -> 57 | B58: DE_OUTLAW | C58: Family #9 | D58: 31562 | E58: 8
A59: =A58+1 -> 58 | B59: Canadian | C59: Family #18 | D59: 22359 | E59: 7
A60: =A59+1 -> 59 | B60: GIR | C60: Family #16 | D60: 11512 | E60: 7
A61: =A60+1 -> 60 | B61: Flying Cows | C61: Family #13 | D61: 50120 | E61: 6
A62: =A61+1 -> 61 | B62: LORDxKIET | C62: Family #19 | D62: 60068 | E62: 5
A63: =A62+1 -> 62 | B63: Foolish Fobbahs | C63: Family #16 | D63: 23891 | E63: 5
A64: =A63+1 -> 63 | B64: HeavenBorders | C64: Family #7 | D64: 88707 | E64: 4
A65: =A64+1 -> 64 | B65: dynamo kiev | C65: Family #0 | D65: 33044 | E65: 4
A66: =A65+1 -> 65 | B66: Maitreya | C66: Family #15 | D66: 85405 | E66: 3
A67: =A66+1 -> 66 | B67: kapbois | C67: Family #10 | D67: 48988 | E67: 3
A68: =A67+1 -> 67 | B68: Knight Deraj | C68: Family #8 | D68: 32315 | E68: 3
A69: =A68+1 -> 68 | B69: Dirk | C69: Family #3 | D69: 29993 | E69: 3
A70: =A69+1 -> 69 | B70: sachr | C70: Family #26 | D70: 19591 | E70: 3
A71: =A70+1 -> 70 | B71: Fenriswolf | C71: Family #16 | D71: 12032 | E71: 3
A72: =A71+1 -> 71 | B72: valique | C72: Family #12 | D72: 11427 | E72: 3
A73: =A72+1 -> 72 | B73: Dark Realm | C73: Family #16 | D73: 10097 | E73: 3
A74: =A73+1 -> 73 | B74: The Galbadian Empire | C74: Family #7 | D74: 6359 | E74: 3
A75: =A74+1 -> 74 | B75: Alfa Centauri | C75: Family #3 | D75: 5420 | E75: 3
A76: =A75+1 -> 75 | B76: ViceCity | C76: Family #31 | D76: 4834 | E76: 3
A77: =A76+1 -> 76 | B77: Punjab | C77: Family #2 | D77: 3755 | E77: 3
A78: =A77+1 -> 77 | B78: zeta101 | C78: Family #2 | D78: 3468 | E78: 3
A79: =A78+1 -> 78 | B79: wouboe nation | C79: Family #26 | D79: 3343 | E79: 3
A80: =A79+1 -> 79 | B80: blastosium | C80: Family #20 | D80: 3326 | E80: 3
A81: =A80+1 -> 80 | B81: astra | C81: Family #23 | D81: 51120 | E81: 2
A82: =A81+1 -> 81 | B82: rogueleader | C82: Family #18 | D82: 13333 | E82: 2
A83: =A82+1 -> 82 | B83: Aridia | C83: Family #0 | D83: 8791 | E83: 2
A84: =A83+1 -> 83 | B84: miniBOB | C84: Family #15 | D84: 7807 | E84: 2
A85: =A84+1 -> 84 | B85: Tailchaser | C85: Family #12 | D85: 5182 | E85: 2
A86: =A85+1 -> 85 | B86: Titan | C86: Family #26 | D86: 4464 | E86: 2
A87: =A86+1 -> 86 | B87: LowFrequency | C87: Family #31 | D87: 4055 | E87: 2
A88: =A87+1 -> 87 | B88: Zechs | C88: Family #12 | D88: 2528 | E88: 2
A89: =A88+1 -> 88 | B89: ddd | C89: Family #28 | D89: 2524 | E89: 2
A90: =A89+1 -> 89 | B90: Crusaders | C90: Family #30 | D90: 107015 | E90: 1
A91: =A90+1 -> 90 | B91: Burning Blood | C91: Family #7 | D91: 52683 | E91: 1
A92: =A91+1 -> 91 | B92: Arch Bishop Virza | C92: Family #24 | D92: 18516 | E92: 1
A93: =A92+1 -> 92 | B93: Wonderland | C93: Family #1 | D93: 17304 | E93: 1
A94: =A93+1 -> 93 | B94: dolboyebi vse | C94: Family #5 | D94: 14791 | E94: 1
A95: =A94+1 -> 94 | B95: Da Dragon Army | C95: Family #3 | D95: 12468 | E95: 1
A96: =A95+1 -> 95 | B96: The Forge of Valor | C96: Family #4 | D96: 10271 | E96: 1
A97: =A96+1 -> 96 | B97: Dunno4now | C97: Family #24 | D97: 9251 | E97: 1
A98: =A97+1 -> 97 | B98: shadow kingdom | C98: Family #20 | D98: 7857 | E98: 1
A99: =A98+1 -> 98 | B99: spooky3do | C99: Family #25 | D99: 7784 | E99: 1
A100: =A99+1 -> 99 | B100: duelmasters | C100: Family #9 | D100: 7108 | E100: 1
A101: =A100+1 -> 100 | B101: Draytax | C101: Family #9 | D101: 6984 | E101: 1
A102: =A101+1 -> 101 | B102: Perksy | C102: Family #1 | D102: 6940 | E102: 1
A103: =A102+1 -> 102 | B103: EvilDiablo | C103: Family #1 | D103: 6330 | E103: 1
A104: =A103+1 -> 103 | B104: windowsME | C104: Family #27 | D104: 6023 | E104: 1
A105: =A104+1 -> 104 | B105: Freedom Owner | C105: Family #31 | D105: 5904 | E105: 1
A106: =A105+1 -> 105 | B106: Persian_Empire | C106: Family #31 | D106: 5788 | E106: 1
A107: =A106+1 -> 106 | B107: Knights of Darkness | C107: Family #4 | D107: 5543 | E107: 1
A108: =A107+1 -> 107 | B108: Planet_Of_The_Dark | C108: Family #31 | D108: 4284 | E108: 1
A109: =A108+1 -> 108 | B109: Porcus | C109: Family #29 | D109: 4160 | E109: 1
A110: =A109+1 -> 109 | B110: The Universal Forces | C110: Family #15 | D110: 3774 | E110: 1
A111: =A110+1 -> 110 | B111: Hyunckel | C111: Family #16 | D111: 3699 | E111: 1
A112: =A111+1 -> 111 | B112: Trinolia | C112: Family #9 | D112: 3604 | E112: 1
A113: =A112+1 -> 112 | B113: ICE | C113: Family #19 | D113: 3530 | E113: 1
A114: =A113+1 -> 113 | B114: Commonwealth | C114: Family #17 | D114: 3500 | E114: 1
A115: =A114+1 -> 114 | B115: Gavin | C115: Family #22 | D115: 3499 | E115: 1
A116: =A115+1 -> 115 | B116: maloreon | C116: Family #13 | D116: 3376 | E116: 1
A117: =A116+1 -> 116 | B117: MagesGuild | C117: Family #15 | D117: 3372 | E117: 1
A118: =A117+1 -> 117 | B118: BadTrip | C118: Family #16 | D118: 3332 | E118: 1
A119: =A118+1 -> 118 | B119: PayBack Time | C119: Family #28 | D119: 3309 | E119: 1
A120: =A119+1 -> 119 | B120: RogueSun | C120: Family #24 | D120: 3204 | E120: 1
A121: =A120+1 -> 120 | B121: Dopefish Dreaded Destroyers | C121: Family #1 | D121: 3181 | E121: 1
A122: =A121+1 -> 121 | B122: Kakadoen | C122: Family #6 | D122: 3141 | E122: 1
A123: =A122+1 -> 122 | B123: Woof | C123: Family #10 | D123: 2980 | E123: 1
A124: =A123+1 -> 123 | B124: reborn bloody | C124: Family #4 | D124: 2860 | E124: 1
A125: =A124+1 -> 124 | B125: Lord Roxter | C125: Family #7 | D125: 2860 | E125: 1
A126: =A125+1 -> 125 | B126: Mudvaynia | C126: Family #13 | D126: 2830 | E126: 1
A127: =A126+1 -> 126 | B127: NETZER | C127: Family #14 | D127: 2700 | E127: 1
A128: =A127+1 -> 127 | B128: Aldi | C128: Family #22 | D128: 2690 | E128: 1
A129: =A128+1 -> 128 | B129: Pain | C129: Family #28 | D129: 2660 | E129: 1
A130: =A129+1 -> 129 | B130: Dripping Green Load | C130: Family #13 | D130: 2640 | E130: 1
A131: =A130+1 -> 130 | B131: ducttape | C131: Family #28 | D131: 2556 | E131: 1
A132: =A131+1 -> 131 | B132: Ures main | C132: Family #14 | D132: 2540 | E132: 1
A133: =A132+1 -> 132 | B133: bird meat | C133: Family #7 | D133: 2340 | E133: 1
A134: =A133+1 -> 133 | B134: The Monkeys will Eat YOU | C134: Family #12 | D134: 2140 | E134: 1
A135: =A134+1 -> 134 | B135: Porn | C135: Family #1 | D135: 2060 | E135: 1
A136: =A135+1 -> 135 | B136: CrimsonWarriors | C136: Family #21 | D136: 2016 | E136: 1
A137: =A136+1 -> 136 | B137: RawServe | C137: Family #3 | D137: 1940 | E137: 1
A138: =A137+1 -> 137 | B138: Of My Guitar | C138: Family #27 | D138: 1900 | E138: 1
A139: =A138+1 -> 138 | B139: blank3 | C139: Family #5 | D139: 1740 | E139: 1
A140: =A139+1 -> 139 | B140: Creeps | C140: Family #7 | D140: 1740 | E140: 1
A141: =A140+1 -> 140 | B141: the empire | C141: Family #22 | D141: 1740 | E141: 1
A142: =A141+1 -> 141 | B142: Unimatrix | C142: Family #12 | D142: 1740 | E142: 1
A143: =A142+1 -> 142 | B143: Peeplordia | C143: Family #21 | D143: 1740 | E143: 1
A144: =A143+1 -> 143 | B144: duelists | C144: Family #25 | D144: 1740 | E144: 1
A145: =A144+1 -> 144 | B145: shadowrunners | C145: Family #13 | D145: 1740 | E145: 1
A146: =A145+1 -> 145 | B146: Flame Warriors | C146: Family #27 | D146: 1740 | E146: 1
A147: =A146+1 -> 146 | B147: pakao | C147: Family #6 | D147: 1740 | E147: 1
A148: =A147+1 -> 147 | B148: DDD | C148: Family #30 | D148: 1740 | E148: 1
A149: =A148+1 -> 148 | B149: sjapap | C149: Family #30 | D149: 1740 | E149: 1
A150: =A149+1 -> 149 | B150: sss | C150: Family #5 | D150: 1740 | E150: 1
A151: =A150+1 -> 150 | B151: mung | C151: Family #11 | D151: 1740 | E151: 1
A152: =A151+1 -> 151 | B152: The Majestic Rulers | C152: Family #5 | D152: 1740 | E152: 1
A153: =A152+1 -> 152 | B153: Valleyman Jr | C153: Family #9 | D153: 1740 | E153: 1
A154: =A153+1 -> 153 | B154: WADs | C154: Family #30 | D154: 1740 | E154: 1
A155: =A154+1 -> 154 | B155: NeVeR_LooSe | C155: Family #17 | D155: 1740 | E155: 1
A156: =A155+1 -> 155 | B156: Talon | C156: Family #12 | D156: 1740 | E156: 1
A157: =A156+1 -> 156 | B157: qads | C157: Family #0 | D157: 1740 | E157: 1
A158: =A157+1 -> 157 | B158: Crazy One | C158: Family #19 | D158: 1740 | E158: 1
A159: =A158+1 -> 158 | B159: Marx | C159: Family #28 | D159: 1740 | E159: 1
A160: =A159+1 -> 159 | B160: Marx | C160: Family #7 | D160: 1740 | E160: 1
A161: =A160+1 -> 160 | B161: duelist | C161: Family #20 | D161: 1740 | E161: 1
A162: =A161+1 -> 161 | B162: duelmasters | C162: Family #11 | D162: 1740 | E162: 1
A163: =A162+1 -> 162 | B163: duelist kingdom | C163: Family #6 | D163: 1740 | E163: 1
A164: =A163+1 -> 163 | B164: duelist_kingdom | C164: Family #22 | D164: 1740 | E164: 1
A165: =A164+1 -> 164 | B165: LamdaLamdaLamda | C165: Family #1 | D165: 1740 | E165: 1
A166: =A165+1 -> 165 | B166: Soilders | C166: Family #29 | D166: 1740 | E166: 1
A167: =A166+1 -> 166 | B167: Primonia | C167: Family #18 | D167: 1740 | E167: 1
A168: =A167+1 -> 167 | B168: Prysmos | C168: Family #0 | D168: 1740 | E168: 1
A169: =A168+1 -> 168 | B169: Assassins | C169: Family #9 | D169: 1740 | E169: 1
A170: =A169+1 -> 169 | B170: Appeltje | C170: Family #25 | D170: 1740 | E170: 1
A171: =A170+1 -> 170 | B171: Hmmmm | C171: Family #16 | D171: 1740 | E171: 1
A172: =A171+1 -> 171 | B172: Amish Penguin | C172: Family #3 | D172: 1740 | E172: 1
A173: =A172+1 -> 172 | B173: Pyrussia | C173: Family #23 | D173: 1740 | E173: 1
A174: =A173+1 -> 173 | B174: US | C174: Family #0 | D174: 1740 | E174: 1
A175: =A174+1 -> 174 | B175: RockinMofo | C175: Family #27 | D175: 1740 | E175: 1
A176: =A175+1 -> 175 | B176: TheCoolBassPlaya | C176: Family #27 | D176: 1740 | E176: 1
A177: =A176+1 -> 176 | B177: CoolJammer | C177: Family #13 | D177: 1740 | E177: 1
A178: =A177+1 -> 177 | B178: Majin Gohan | C178: Family #31 | D178: 1740 | E178: 1
A179: =A178+1 -> 178 | B179: Majin Gohan | C179: Family #24 | D179: 1740 | E179: 1
A180: =A179+1 -> 179 | B180: Dark Regions | C180: Family #23 | D180: 1680 | E180: 1